text,Date
"No, Apple Does Not Help the NSA Hack iPhones",12/31/2013
Apple Denies Working With NSA On iPhone Backdoor,12/31/2013
A new operating system tool for the iPhone – “kill switch” to STOP ‘Apple Picking’!,1/2/2014
"NSA Backdoor in Apple Iphone , Ipad and other Products",1/2/2014
"U.S. stocks fell sharply on Thursday, with Wall Street recording its first negative start to a year in six, as a downgrade of Apple hit technology shares and another set of better-than-expected economic reports failed to move investors",1/2/2014
Apple denies working with NSA’s Surveillance implant,1/2/2014
The next big Apple-Google battle looks much bigger than smartphones,1/3/2014
"""Texas [USA] has seen the future of the public library, and it looks a lot like an Apple Store: Rows of glossy iMacs beckon. iPads mounted on a tangerine-colored bar invite readers. . . . But this $2.3 million library might be most notable for what it does not have -- any actual books.""",1/4/2014
Apple bluntly denies knowledge of NSA's iPhone hack program,1/4/2014
A Little Guy Sticks It to Apple and Jamie Dimon,1/6/2014
Apple's new Retail Chief 'may' hint at the company's move towards wearable technology. (maybe Burberry Apple iGlass??),1/6/2014
"Apple, Amazon downgraded 'on moral and ethical grounds'",1/6/2014
Fake Apple MacBook Pro Giveaway Facebook Offer January 6 2014,1/6/2014
Apple presents a new television set with remote control inserted in a ring,1/6/2014
PC Protective Hard Back Skin Case Cover for Apple iPhone 5 5G 5th (Apple Accessories),1/7/2014
"Apple: Don't Work With Russian Company Whose Creative Director Advocates ""Burning Gays in Ovens""",1/7/2014
LGBT Groups Ask Apple To Cut Ties With Russian Retailer After Creative Director Advocates Burning Gay People Alive,1/8/2014
Passbook Apple,1/8/2014
Agriculture scientists support approving non-browning GM apple but meet resistance from opponents,1/8/2014
Apple iPhone 6 Coming Soon Reportedly : The Big Reveal,1/9/2014
Why you pay big bucks for Apple,1/9/2014
Get New Apple I PAd,1/12/2014
to New Inc.s Partners climb Apple 550 Apple continued has share to stock Inc.s and Patents,1/12/2014
New Apple iPad 64GB,1/12/2014
DealBook: Secretive Apple Squirms in Gaze of U.S. Monitor,1/14/2014
"Qualcomm, Apple and Google soar up patent assignee rankings",1/14/2014
"Federal judge rebukes Apple for its conduct to court-appointed monitor, defends his $1K hourly rate",1/14/2014
Apple Will Refund $32.5 Million To Customers In FTC Settlement Because It Was Easy For Kids To Make In-App Purchases,1/15/2014
Apple will pay $32.5m in settlement to parents over kids' purchases on apps - FTC strikes deal with Apple to refund parents whose children incurred charges on mobile apps while playing,1/15/2014
Apple to refund $32.5m to parents whose kids made in-app purchases,1/15/2014
"Apple settles with FTC over in-app purchases, offering $32 million in refunds",1/15/2014
"U Q4 2013, Apple je prodao skoro 80 miliona mobilnih uređaja sa iOS",1/15/2014
"Apple will refund millions of dollars to consumers ,after allowing kids to make purchases without their parents' consent.",1/15/2014
Apple is Settling with the FTC to Refund and Prevent Kids from Making Unauthorized In-App Puchases,1/15/2014
Government and Apple Settle Children’s App Purchase Inquiry,1/15/2014
"Claims that Adobe, Apple, Google, Intel, Intuit, Lucasfilm and Disney Pixar conspired to suppress workers' wages are bogus, tech giants say, claiming there is ""nothing more"" to the allegations than do-not-cold-call agreements.",1/15/2014
Is Intel The Next Apple?,1/15/2014
Apple iPhone 6S reviews,1/16/2014
"Apple will refund at least $32.5M in app case: ""Kids gleefully snapped up virtual pet food, gems or other items while playing games on their mobile devices, while the bills from Apple Inc. mounted, often without parents' knowledge. Now, the tech giant has agreed to refund the money.""",1/16/2014
After iOS7 beta 4 Apple rolls out its next version,1/16/2014
My reaction to the Twitter white and gray color scheme. Looks too much like Apple.,1/16/2014
Apple će početi sa zamenom iPhone 5C u prodavnici,1/17/2014
Rumors: Apple will lanch a new iPad,1/17/2014
Rumors: Apple will lanch a new iPad on 2014,1/17/2014
iPhone 5c: Screen replacement on Apple Store will start next week,1/17/2014
Mac OS X Flashback Trojan Horse is still infecting Apple Computers,1/18/2014
"Apple releases iOS 7.1 Beta 4 for Carriers, Developers",1/20/2014
Apple - I can afford,1/22/2014
Glass panel at Apple 'cube' store in NYC shattered during snowstorm,1/22/2014
"Activist investor Carl Icahn lashed out against Apple Inc again on Wednesday, and tweeted that he had bought $500 million more shares in the company in just the past two weeks, bringing his investment in the iPhone maker to over $3 billion.",1/22/2014
Apple pobeđuje Android na mobilnom tržištu oglašavanja,1/23/2014
SimplyTheScoop | Scoop | Has Apple Gone Too Far?,1/23/2014
Apple: We're fixing the 'white screen of death',1/23/2014
Apple Just Set The Record For Most Expensive Window Replacement In History,1/23/2014
"Apple reportedly to launch two new iPhones, a Phablet and a Smartphone",1/23/2014
Apple cube glass panel shatters,1/23/2014
"Izgleda poznato? Nova reklama Universal Studio ""pozajmlјuje” dosta toga od Apple",1/24/2014
Report: Apple Preparing to Launch Two Larger iPhones in 2014,1/24/2014
Apple confirms fixing the home screen crash on iPhone devices running iOS 7,1/24/2014
"Apple, Google, Intel and others stole billions from their own engineers",1/24/2014
Next Gen Apple TV Upcoming News,1/24/2014
Apple to Android... Back to Apple?,1/24/2014
Apple lives reportedly building up a mobile payment serve,1/25/2014
Apple promises fix for iOS 7 'screen of death',1/26/2014
"Avoiding Apple, HP returns to mobile with a giant Android phone and a tablet for India",1/26/2014
Apple and Samsung make up two-thirds of the U.S. smartphone market,1/26/2014
iBook Textbooks now available in 51 countries worldwide as Apple pushes for interactive learning,1/27/2014
NSA Project DROPOUT JEEP Hacked Into Apple iPhones,1/27/2014
"Apple posts record holiday earnings thanks to new iPads, iPhones",1/27/2014
"Department of Justice announces new gag-order deal with Google, Facebook, Microsoft and Apple: ""the deal would allow each company to publicly announce the number of FISA requests and national security letters it has received in a given year, as well as the total number of users affected.""",1/27/2014
Apple shares plunge on flat earnings,1/27/2014
Apple says it received less than 250 National Security Orders in the first half of 2013,1/28/2014
Apple breaks iPhone and iPad sales records in Q1 2014,1/28/2014
Difference Between Apple iWatch and Pebble Steel. Pebble Steel Exists.,1/29/2014
"Apple, Microsoft And Other Tech Companies To Help Fund Broadband In 15,000 Schools",1/29/2014
Cómo reutilizar el packaging de Apple,1/30/2014
Apple News Tech Crunch,1/30/2014
"CNN exclusive: Obama says Walmart, Apple, others to help jobless",1/30/2014
Millions of Dollars in Phony $100 Bills Flooding the Big Apple - Midtown,1/30/2014
"live updates: Apple, Samsung spar over potential U.S. ban on smartphone sales",1/31/2014
The apple doesn't fall far from the tree.,1/31/2014
We laugh at naked bodies and take apple butter from old ladies: An ex-TSA agent spills secrets from behind the security line,1/31/2014
Apple iPhone 5s Cases Online,2/1/2014
"Apple Should Pay $840 Million Over E-Books, States Say",2/1/2014
"Apple v Motorola CAFC Oral Arguments Written Transcript: The Posner Appeal September 11, 2013",2/2/2014
"Apple Is Probably Going to Run a Sequel to its ""1984"" Ad Today.",2/2/2014
Apple iPhone Explodes Leaving 14 Year old Girl with 2nd Degree Burns,2/3/2014
Apple (reportedly) hires sleep experts.,2/5/2014
Apple Parts,2/6/2014
Apple is now a National Corporate Partner of HRC. At the Platinum Level!,2/6/2014
Apple Drops all Bitcoin Apps,2/6/2014
Apple-Bitcoin Rift Has Currency’s Fans Ditching IPhones,2/7/2014
Samsung je zatražio od sportista da sakriju Apple logo tokom Olimpijskih igara?,2/7/2014
Apple Repurchases $14 Billion of Own Shares in 2 Weeks,2/7/2014
"This is certainly unfortunate. However, we don’t know why Apple yanked Blockchain. And there is the possibility that the reason Apple removed Blockchain is unrelated to Bitcoin itself.",2/7/2014
Bitcoin Users Smash iPhones After Apple Bans Blockchain Wallet App - redditors make the news again,2/8/2014
Apple reportedly testing wireless and solar charging for iWatch,2/8/2014
Flappy Bird to be removed off of Google Play as well as Apple App store,2/8/2014
Apple debuts ad shot entirely on iPhones,2/9/2014
Apple iPhone 5s is Still World’s Top-Selling Smartphone,2/10/2014
"funeral program templates compatible with Microsoft Word, Open Office, Publisher and Apple iWork Pages",2/10/2014
"Apple iPhone with Flappy Bird selling for $99,900 on EBay... WtTF!",2/10/2014
Samsung Motion For Retrial Denied By Judge Koh in Apple v Samsung,2/10/2014
Article: New Apple Mac Trojan Called OSX/CoinThief Discovered,2/11/2014
"In China, Apple will engrave iPads — if the words aren't too political",2/11/2014
"NYC's first touchscreen subway maps are ready - the first batch of touchscreen subway maps are now ready to be used in some parts of The Big Apple. So far, MTA has installed 18 of these 47-inch panels within Grand Central Station.",2/12/2014
It’s official: Apple sells more computers than all Windows PCs combined,2/13/2014
Apple has begun publicising which of its suppliers may be sourcing minerals from conflict zones,2/13/2014
"Comcast deal a blow to Apple TV and Netflix, Can we please stop this evil giant",2/13/2014
Top 10 Most Expensive Apple Apps,2/13/2014
Court Rejects Apple Appeal in E-Book Case,2/14/2014
Bharti Airtel launches 4G on mobile with Apple in Bangalore,2/14/2014
Apple And Samsung Fail To Settlement Out Of Court Their Legal Issue,2/14/2014
Study: iPhone owners have ‘blind loyalty’ and will buy anything Apple makes,2/14/2014
Comcast/Time Warner deal poised to deliver a serious blow to Apple TV and Netflix,2/14/2014
Apple Should Fear About Startup Of JawBone,2/16/2014
Apple iphone 5C 32GB Specification...Comming Soon,2/16/2014
“Apple is developing sensor technology that would be able to predict heart attacks...[by] the sound blood makes as it travels through a person's arteries.” This is the best use yet for the iWatch -- besides calling to find your phone.,2/16/2014
Possible Merger between Apple and Tesla might be in the works,2/16/2014
Apple Designer Jordan Price Leaves,2/16/2014
Apple primes changes for ACMT certification,2/17/2014
"Flap no more: Google, Apple rejecting flappy-branded games",2/17/2014
Apple iWatch news,2/17/2014
Secession movement in New York pushes for Big Apple to split from Upstate,2/17/2014
Apple and Tesla joining forces???,2/17/2014
"Apple, what the F*(k are you doing? - Are all of our options being made obsolete by bullish*t marketing campaigns?",2/17/2014
Apple to buy Tesla,2/18/2014
"Will Apple buy Tesla Motors? - 'Chronicle' thinks Apple wants to buy, but others aren't so sure...",2/18/2014
Apple-Tesla merger rumour excites investors,2/18/2014
successfully serving the Apple products in Hyderabad,2/18/2014
"Get imac price in india, Hyderabad from Apvision - Apple Authorised Reseller",2/19/2014
"Apple Will Sell The iPhone In Brazil For Nearly $1,200",2/19/2014
"Apple, Google cracking down on 'Flappy Bird' clones",2/19/2014
Your Apple ID Was Just Used to Download OS X Mavericks - Phishing Scam,2/19/2014
Apple co-founder Steve Jobs will be featured in a 2015 stamp being designed by the U.S. Postal Service.,2/20/2014
"Apple Shouldn't Buy Tesla, but (Blank) Should!",2/21/2014
Apple discharges ios 7.0.6 and 6.1.6 overhaul to settle real SSL security Bug.Altaas,2/22/2014
Application developers manipulate the Apple App store scamming thousands of dollars per day,2/22/2014
"Apple Inc said on Saturday it would issue a software update ""very soon"" to cut off the ability of spies and hackers to grab email, financial information and other sensitive data from Mac computers.",2/22/2014
Apple security flaw allows hackers to beat encryption,2/22/2014
Apple security flaw: Hackers could enter mobile devices and more,2/23/2014
"War on discounts: Handset makers like Sony, Apple, Nokia, Samsung fighting online 'price distortions'",2/23/2014
Apple issues fix for exploit allowing a MITM attack.,2/24/2014
Apple products at high risk for hacker attacks | TheCelebrityCafe.com,2/24/2014
Apple users beware!,2/24/2014
Apple to Arizona: Anti-gay bill puts Mesa sapphire plant at risk,2/25/2014
Very best Apple iphone Applications From Australia And The Globe,2/25/2014
Apple asks Arizona Governor to veto bill that would let businesses refuse service to gay customers,2/25/2014
Apple Laptop Replacement Batteries,2/25/2014
Apple commemorates Mac’s 30th anniversary with movie shot by iPhone,2/26/2014
How Apple Went to War Over Arizona Anti-Gay Bill,2/26/2014
Download Windows 7 for free and also briefed on the latest Apple-developed modern and download the software for free now Apple,2/26/2014
"Apple Specialist, Iphone Repair New Jersey | istorenj.com",2/26/2014
"Women prefer Apple, gentlemen prefer Samsung",2/26/2014
Apple is Fortune's 'most admired' for 7th year in a row,2/27/2014
"How Apple, the NFL and other big businesses helped kill the Arizona bill to deny services to gay customers",2/27/2014
"How Google, Apple, and Twitter avoid taxes",2/27/2014
"Šef SONY-a: ""Apple bi trebalo češće da predstavlja telefone""",2/28/2014
Exactly how you could make Apple-pie order when Little Time Left in Wedding,2/28/2014
"One year later, the police have not been able to access Oscar Pistorious's Apple ID/Password",2/28/2014
Tim Cook advises climate change deniers to get out of Apple stock | Apple,2/28/2014
Get the New Apple iPad 64GB,2/28/2014
Apple ve iPhoneRehber blog sitesi,3/1/2014
Tim Cook to Climate Change Deniers: Get Out of Apple Stock,3/2/2014
How to Make Home made Apple Cake with Marzipan Filling,3/2/2014
The Remarkable RoboMe Robot Toy That Combine The Power of The Apple iPhone,3/2/2014
Out There ipa apple games download,3/3/2014
Tim Cook tells climate change sceptics to ditch Apple shares,3/3/2014
Apple software to drive smart Ferrari,3/3/2014
"At Apple shareholder’s meeting, Tim Cook tells off climate change deniers",3/3/2014
"Apple, Inc., CFO Peter Oppenheimer to Retire",3/4/2014
Apple Directors Overrule Shareholders on Spy Lockout as Woz Joins Movement,3/4/2014
"Roku announces $49.99 Streaming Stick, a Chromecast, Apple TV rival",3/4/2014
Apple may make Siri smarter by tapping into your apps,3/5/2014
Apple moved $9bn in untaxed profit from Australia to Ireland.,3/5/2014
"Apple iPhone 5S Case Bumper Review , Wordpress 3.7.1Apple iPhone 5S Case Bumper Review , Wordpress 3.7.1",3/6/2014
£219.99 - BRAND NEW Apple iPAD Air 16GB Wi-Fi Tablet Computer Black - Space Gray,3/6/2014
Apple Updates iTunes Festival App For SXSW - but iOS 7?,3/7/2014
Unlock Apple iPhone,3/7/2014
Apple loses bid for U.S. ban on Samsung smartphone sales,3/7/2014
"Apple at work on full 4K display support in Mavericks, report says",3/7/2014
Al Fakher Apple Tobacco,3/7/2014
iPhones holding Apple back?,3/8/2014
Acavano picks up where Apple left off with iOS cards app. Acavano says a new approach was needed is all.,3/9/2014
Apple Repair Miami,3/10/2014
Apple is asking record labels for exclusive iTunes releases,3/11/2014
"Apple Releases iOS 7.1 With CarPlay, Touch ID Improvements, Visual Tweaks - Cyber Kendra",3/11/2014
One Bad Apple .....,3/11/2014
Cheap Iphone Apple Accessories,3/12/2014
Cash Abroad Rises $206 Billion as Apple to IBM Avoid Tax,3/12/2014
"Patent uzmanı Florian Mueller, bloğundan yaptığı açıklamada Apple ile Samsung arasında ay sonunda başlayacak olan telif davasında Apple’ın 5 patent için telefon başına 40 dolar isteyeceğini ifade etti.",3/12/2014
Cash Abroad Rises $206 Billion as Apple to IBM Avoid Tax: Bloomberg Business News - MSN Money,3/13/2014
United Airlines To Provide Free In-Flight Entertainment For Apple Users,3/13/2014
Apple Replaces Phone That Saved Soldier's Life,3/13/2014
Apple je potpisao ugovor sa DVA operatera u Srbiji,3/14/2014
Edward Snowden is a hero: Apple co-founder Steve Wozniak,3/14/2014
Apple iOS 8′de Neler Olacak. ?,3/16/2014
"So I went to smoke my crack pipe, and it made my house smell like warm apple pie. That's not normal, right?",3/17/2014
Apple Release 8Gb version of iPhone 5C - Cyber Kendra,3/18/2014
"Apple, Microsoft Hoard Cash – US Taxpayers Pay the Bill | Common Dreams",3/18/2014
Apple Replaces iPad 2 with iPad 4; Still $399,3/18/2014
"Apple is censoring the word ""Android"" from App Store reviews",3/18/2014
EA Games website hacked to steal Apple IDs - Cyber Kendra,3/19/2014
Apple Loans Blog -,3/19/2014
Jesse Jackson calls out Apple and other tech companies for lack of racial diversity,3/19/2014
NFL Apple iPhone & Samsung Galaxy Cases,3/20/2014
EA Games site hacked to steal Apple IDs,3/20/2014
Apple schikt zich naar Belgische wet,3/21/2014
Joe Pesci to play Steve Jobs in upcoming biopic of the Apple pioneer,3/21/2014
"BREAKING NEWS: Apple announces WWDC 2014, teases bezel-free iPhone 6",3/21/2014
"Revealed: Apple and Google’s wage-fixing cartel involved dozens more companies, over one million employees",3/22/2014
Apple in Talks with Comcast About Streaming-TV Service,3/23/2014
"Apple in talks with Comcast about streaming TV service, wants the new TV service's traffic to be separated from public Internet traffic over the ""last mile""",3/23/2014
"Apple in Talks with Comcast to increase the internet speed of Apple TV over ""public internet traffic"" (the future of no net neutrality is here).",3/24/2014
"Report: Apple, Comcast Discussing Streaming Video Deal | PCMag.com",3/24/2014
Apple Trying To Cut Streaming TV Deal With Comcast: WSJ,3/24/2014
Apple and Comcast: Another blow for Net Neutrality,3/24/2014
"iOS 8 Beta Concept & Release: After iOS 7 Overhaul, Apple Not Expected To Revamp iOS 8 Interface; Notifications, Maps App Rumored To Change",3/24/2014
Netflix Sinks After Apple-Comcast Streaming TV Talks Revealed,3/24/2014
Apple wants to bypass net neutrality for its own streaming video service,3/25/2014
"Google, Apple, and Other Tech Titans’ Wage-Suppression Conspiracy Estimated to Cover One Million Workers",3/25/2014
"Secret Internal Memos Show How Google, Apple & The Biggest Tech Companies Colluded to Fix Workers' Wages",3/26/2014
Unfortunate Co-incidence over Apple Ad & Malaysia Flight 370 Headline,3/26/2014
Apple ran the wrong ad beside a new york-times story about flight 370,3/26/2014
Apple seeks greater emoji racial diversity,3/27/2014
Apple Came Up With A Way To Stop You From Bumping Into Things While Texting And Walking,3/27/2014
Apple is Attempting to Make Walking and Texting Safer,3/27/2014
Apple Expected To Launch iPhone 6 In September,3/28/2014
U.S. judge OKs class action in e-book suit against Apple,3/28/2014
"Apple, Google lose bid to avoid trial on tech worker lawsuit",3/29/2014
"Judge denies last-ditch effort by Google, Apple to have wage fixing lawsuit tossed. Trial begins May 27",3/29/2014
"“Apple iPhone 5C” Worth Rs.41900 For Rs.37,800 on Amazon",3/30/2014
Cooking Everything From Apple Pie To Zwiebacks With One Of These Tips,3/30/2014
Apple wants to enable peoples' texting and walking addictions,3/31/2014
Apple openly admits that it will share user data with NSA.,4/1/2014
Apple acquires Ifixit,4/1/2014
Apple demanda A Samsung nuevamente por 2 mil millones de dolares,4/1/2014
Apple buys Beats Music Streaming Service,4/1/2014
This Deal betwen Apple and Microsoft Is Going To Bury Google- NEWS,4/1/2014
"Amazon unveils Fire TV - competes with Roku, Apple TV, and Chromecast",4/3/2014
"Major U.S. companies including Ford, Apple and Pfizer have formed a lobbying group aimed at pushing back at some changes to the patent system members of Congress have proposed, saying these measures would hinder protection of valuable inventions.",4/3/2014
"Apple, Microsoft, IBM, & others team up to defend U.S. patent system",4/4/2014
"The Apple iPhone 5s and iPhone 5c clinched the top two positions, while Samsung's smartphones dominated the rest of the chart.",4/7/2014
Student Allegedly Hacks Apple Passbook for Free Flights,4/7/2014
Apple! I just got a free iPad Mini,4/7/2014
Steve Jobs wanted to launch a 'Holy War' on Google: Emails outline Apple founder's strategy for company a year before his death,4/8/2014
Apple is betting big on the iWatch with 65 Million Orders for a Q3 release,4/8/2014
"Apple, Google & others could pay 'blindingly high' $9B in anti-poaching class-action suit",4/8/2014
Apple Details $2.2 Billion Damages Claim Against Samsung,4/8/2014
Report: Apple iWatch Will Monitor Your Exposure to Harmful UV Rays,4/9/2014
"Apple Pie, Baseball and Bribing the Pentagon",4/9/2014
Apple is planning a massive rollout in Q3,4/9/2014
Backup DVD to Apple TV with Practical DVD Video Converter,4/10/2014
"Heartbleed Bug: Apple Confirms iPhones, iPads and Macs Not Vulnerable",4/11/2014
Exclusive: Apple vs. Samsung docs reveal Galaxy Tab was a flop and Samsung knew it,4/11/2014
"A federal appeals court on Friday unanimously threw out the conviction of an Arkansas man for stealing the personal data of about 120,000 Apple iPad users, including big-city mayors, a TV news anchor and a Hollywood movie mogul.",4/11/2014
Suspected laptop thief busted after calling Apple customer support for help,4/11/2014
Apple to consider Android version of iTunes after underwhelming performance of iTunes Radio,4/12/2014
Apple i Microsoft imaju veće novčane fondove od mnogih zemalja,4/14/2014
Samsung exec says he's not familiar with the smartphone features Apple is suing over,4/14/2014
Apple iTunes Unlock,4/15/2014
Apple Introduces New iPad Smart Case,4/15/2014
APPLE LOVERS- PR5 website for sale,4/15/2014
Apple Wants To Keep Evidence That Steve Jobs Was A 'Bully' Out Of Court,4/15/2014
Apple loses bid to dismiss states' e-book antitrust cases,4/16/2014
Laptop thief caught with the help of Apple tech support team.,4/16/2014
Website with automatic apple reviews for sail. It makes money for you without you doing anything.,4/16/2014
APPLE LOVERS- PR5 with 165000 exact monthly searches $459.53 3 months revenue,4/17/2014
Red Apple Awards For 2 Honorary Men @ Aquarium,4/18/2014
Samsung vs APPLE LATEST,4/18/2014
Apple Hire from Easirent Ltd,4/19/2014
Malware Targeting Jailbroken Apple iOS Devices - Cyber Kendra,4/19/2014
Has Apple maps found the Loch Ness Monster?,4/19/2014
Lock Ness Monster Found By Apple maps,4/19/2014
Loch Ness Monster sighting made using Apple Maps!,4/19/2014
Nessie Diehards Claim Apple Maps Shows the Loch Ness Monster,4/19/2014
Apple Maps takes picture of Loch Ness Monster,4/20/2014
Loch Ness Monster Reportings on the Rise After Sighting on Apple Maps,4/20/2014
Loch Ness Monster Not Found In Apple Maps,4/21/2014
Has the Loch Ness Monster been spotted on Apple Maps?,4/21/2014
Apple Is Helping To Recycle All Apple Products For Free,4/22/2014
Apple proposes free recycling of all its used products,4/22/2014
Apple offering free recycling of all used products,4/22/2014
"""Wage Theft Across The Board"" - Google, Apple, Intel, Adobe expected to reach settlement with workers who claim $3 Billion in stolen wages",4/22/2014
"64,613 Software Engineers Join Class Action Hiring Conspiracy Lawsuit against Apple, Google, Intel and Adobe - AllGov - News",4/22/2014
Apple aims text disabling while driving,4/22/2014
Is an Apple-Nike partnership on the way?,4/22/2014
Apple taunts Samsung,4/23/2014
Apple Calorie Count - Apple Nutrition Facts,4/23/2014
Apple aims to disable texting while driving,4/23/2014
Apple splitting its stock 7:1 effective in June,4/23/2014
"Apple expands buybacks by $30 billion, OKs seven-for-one stock split",4/23/2014
"Apple announces 7-for-1 stock split, buybacks bumped to $90 billion",4/23/2014
Apple profits beat expectations,4/23/2014
"Former actor, Sean Allen Briskey pleads not guilty to murder of MMA fighter in Apple Valley, CA",4/23/2014
Apple teases Samsung in new environmental print ad: ‘There are some things we want every company to copy’,4/23/2014
"An Apple a Day, and Other Myths: Much of what you think you know about nutrition is not actually backed by science",4/23/2014
Chemicals killing smartphone chip factory workers: Samsung and Apple factories accused,4/23/2014
Apple resets the clock as investors await next big thing,4/24/2014
Apple founder Steve Jobs honoured in a list of the Top 100 Greatest Ever Americans,4/24/2014
Apple profits surprise investors as company launches charm offensive,4/24/2014
APPLE shares soar on increased buyback,4/24/2014
"Apple, Google, Adobe, Intel Agree to Settle Wage Theft Lawsuit Alleging Hiring Conspiracy",4/24/2014
"Google, Apple settle deal and pay $324 million for conspiring to hold down salaries of employees.",4/24/2014
Google and Apple Settle Class-Action Lawsuit Alleging Wage Fixing,4/24/2014
Four major tech companies including Apple and Google have agreed to pay a total of $324 million to settle a lawsuit accusing them of conspiring to hold down salaries in Silicon Vall,4/24/2014
Four major tech companies including Apple and Google have agreed to pay a total of $324 million to settle a lawsuit accusing them of conspiring to hold down salaries in Silicon Valley,4/24/2014
"""Apple: Climate Change is Real and It's a Real Problem""",4/25/2014
"Apple, Google to pay $324 million to settle conspiracy lawsuit",4/25/2014
"Exclusive: Apple, Google to pay $324 million to settle conspiracy lawsuit",4/25/2014
"Apple, Google agree to settle lawsuit alleging hiring conspiracy",4/25/2014
Apple started replacement programme for faulty power button in iPhone 5,4/26/2014
Infusion Rate Calculator App for Apple IOS,4/26/2014
"Apple CEO Blasts Conservatives, Dismisses Profit Motive",4/26/2014
