text,Date
it's an hour of joke!! =D Apple Iwatch fake video!! (Jimmy Kimmel),7/25/2014
"Apple iPhones allow extraction of deep personal data, researcher finds",7/26/2014
Man scams Apple stores using a credit card trick that is hard to believe actually exists.,7/26/2014
Make the most of All The Apple iphone Needs to Deal,7/27/2014
"A 24-Year-Old Allegedly Used A Simple But Brilliant Scam To Cheat Apple Out Of $300,000",7/28/2014
"Convert, Transfer, Backup and Restore for your iPad, iPhone and iPod Touch. Apple News. Android News.",7/28/2014
"Well... at least he thinks different. (Experts say Tampa fraudster scams $300K from apple, exposes flaw)",7/29/2014
Much of Tesla’s UI design team comes from Apple [Video],7/29/2014
"24 year old scams Apple over 40 times. To the tune of $309,768.",7/29/2014
Apple TV Updates With Two New TV Channels,7/29/2014
Apple workers take their employer to court,7/30/2014
Why I Never EVER Buy any Apple Products: Hfs Research revealed that one in every three worker in Apple is an H-1B Asian Indian.,7/30/2014
Does Apple deliberately slow its old iPhones before a new release? Searches for 'iPhone slow' show a spike ahead of launches.,7/31/2014
NomadPlus Transforms an Apple Charger Into a Portable Battery,7/31/2014
Polish people are using apple-eating selfies to give Putin the finger,7/31/2014
Poland takes the bite out of Russian apple ban,7/31/2014
Apple to beat off employees,8/1/2014
Apple Officially Owns Beats - The Transaction Has Been Finalized,8/1/2014
Apple Retina MacBook Pro – Speedy Target,8/1/2014
Apple $450 million e-book settlement wins court approval,8/1/2014
"Tampa man accused of scamming Apple out of $309,768",8/2/2014
Legit way to get free Apple products?,8/2/2014
"Week in review: Thoughts on mobile (next disruptor, 10 Home windows apps, Apple hybrid).",8/2/2014
"Apple Macbook pro 15"" A1286 2.53GHz Logic Board 820-2533-B",8/3/2014
Reason why an apple a day keeps a doctor away,8/4/2014
"Samsung, Apple end lawsuits around the world, will still fight in US",8/6/2014
Apple iPhone 5s Screen Replacement Program Set To Hit Europe,8/6/2014
Sam Sung Auctions Off His Apple Business Card for Charity,8/6/2014
Former Apple employee Sam Sung is cashing in on cool name for charity,8/6/2014
"Apple Retail in Vancouver once employed a guy named, Sam Sung. Sam is no auctioning off his old blue shirt and business card for charity and is currently at $1,775",8/6/2014
Burger King Customer Buys 23 Apple Pies Just So Loudmouthed Kid Can’t Get One,8/6/2014
Apple set to unveil new iPhones Sept. 9,8/6/2014
Apple has confirmed iPhone 6 Release date in coming September,8/6/2014
Apple Service Center in Laxmi Nagar,8/7/2014
"Samsung and Apple agree to drop all ""Samsung Apple Cases"" outside the U.S",8/7/2014
Apple and Samsung agree to end patent litigation outside the US,8/7/2014
"eBay for Sam Sung's Apple business card reaches $80,000",8/7/2014
Daftar Harga dan Spesifikasi Laptop Apple Agustus 2014 | Himax Indonesia,8/7/2014
"Apple Specialist Sam Sung items on bid on eBay already at $80,000!",8/7/2014
Former Apple employee named 'Sam Sung' auctions off business card,8/7/2014
"Emerging networking technology used by Apple, Cisco will frustrate firewalls",8/8/2014
Accessories | Airport & Wireless | Apple TV,8/8/2014
Apple and their pathetic customer service,8/8/2014
"Judge rejects $324.5M wage-fixing deal struck by Apple, Google, others as too low",8/8/2014
"Judge says $324.5 million settlement is too low for Apple, Google, Intel, Adobe violation of Sherman Antitrust Act...expert estimates $3 billion would be moar reasonable compensation",8/8/2014
"Judge rejects $324.5 million settlement over Apple, Google hiring",8/9/2014
"$324.5 million anti-poaching settlement from Apple, Google rejected. District judge says settlement ""falls below the range of reasonableness.""",8/9/2014
"Ex Apple employee 'Sam Sung' auctions off his last business card, already reaching bids of $80,000 to be donated to charity",8/9/2014
Apple Offers Huge Sale on 20 Top Productivity Apps,8/9/2014
New apple iphone 6 Designs to Have Staggered Launch Dates To Decrease Competitors?,8/9/2014
5 interesting facts about Apple,8/10/2014
Apple employee Sam Sung auctions his business card on eBay,8/11/2014
Apple tells you which apps are compatible with family sharing,8/11/2014
Google Analytics is finally available for apple iphone 5 and various other iOS devices,8/12/2014
Portland Apple Store Prints Homophobic Slur on Queer Customer's Receipt,8/12/2014
"Apple: mostly men, mostly white",8/12/2014
Good ideaAnd Tricks For Your Apple iphone,8/12/2014
Apple ID Login,8/12/2014
Apple publishes its diversity report,8/13/2014
Apple Bans Use of 2 Chemicals in iPhone Assembly,8/13/2014
Apple honors Robin Williams with tribute Web page,8/13/2014
Apple Says Its Workforce Is 70% Male,8/13/2014
Apple begins storing users' personal data on servers in China,8/15/2014
The Best New Cooking App of 2014: Audio Chef Co. from Apple Magazine,8/15/2014
Apple admits storing users' data in China,8/15/2014
Every thing You Needed To Know About Your Apple iphone,8/16/2014
The leaked sources have confirmed that Apple has decided to launch 5.5 inches screen with the name of iPhone 6L.,8/17/2014
Apple will store some user data in mainland China,8/17/2014
Details and truths concerning Actually excellent apple iphone Application Spy Providers,8/18/2014
Pointer and Guidance regarding Finest apple iphone Spy,8/19/2014
Cabo Lightning Reversivel da Apple pode chegar antes do que você pensa,8/19/2014
University of Michigan junior Mark Gurman makes six figures a year reporting on Apple,8/20/2014
Apple Employee Salaries (USD),8/21/2014
Apple Offers Free iPhone 5 Battery Replacement - See if Yours Is Eligible,8/23/2014
How Apple Could Give Google Android A Run For Its Money ?....lets checkout some New and improved features of Apple iOS 8. ..its really wow experience for me..,8/23/2014
Apple market value hits $600B,8/25/2014
Apple Worth $100 Billion More Than GE and Walmart Combined (NASDAQ: AAPL),8/25/2014
"LAUSD officials had close ties with Apple, Pearson execs, records show",8/26/2014
"Obesity Action Coalition (OAC) Calls On Amazon, Apple, Google And Microsoft To Remove Fat Shaming Apps From Online Stores",8/26/2014
Simplify Every thing With These Apple iphone Suggestions And Methods,8/27/2014
Apple To Boost IPad Size Next Be Preparing,8/27/2014
Watch Out! Apple might be spying on you through your iPhone | DeeR Digest,8/27/2014
Apple to Unveil 'iWatch' on September 9: Report,8/27/2014
"Buy Wholesale Apple Accessories ,iPhone ,iPad Case from Aulola.co.uk",8/28/2014
Apple announces special event for Sept. 9,8/28/2014
Apple Store Guards Stage Sit-In Demanding Higher Wages,8/28/2014
And its finally official. Apple sends out invitations to a special event for September 9 and is expected to unveil the iPhone 6 and the iWatch,8/29/2014
Verify Out These Great Apple iphone Methods That Are Truly Easy,8/29/2014
A Apple constrói enorme estrutura para evento do iPhone 6,8/30/2014
Mystery Structure In Cupertino Adds To Secretive Nature Of Apple Product Launch Announcement,8/30/2014
"The new Apple campus construction site, as seen from a drone",8/31/2014
Apple Partnering With American Express On New iPhone Payments System,9/1/2014
"Apple Said to Team With Visa, MasterCard on IPhone Wallet",9/1/2014
AnandTech Publisher Anand Shimpi Headed to Apple,9/1/2014
Apple Has Considered $400 Price for Wearable Device,9/1/2014
Apple iphone 5C 16GB 3G 4G Mobile Price and Specification in Pakistan,9/1/2014
Apple iphone 5 16GB 3G 4G Mobile Price and Specification in Pakistan,9/1/2014
Well known security problems with iCloud is reason behind the release of leaked photographs. Apple doesn't take responsibility.,9/1/2014
Apple quiet on iCloud exploit after celebrity nudes leak,9/1/2014
Jennifer Lawrence’s Naked Photos Leak Online: Apple under scrutiny,9/1/2014
"Apple patches ""Find My iPhone"" exploit that may have been used to hack iCloud accounts",9/1/2014
Apple Just Patched A Security Flaw In iCloud That Could've Been Used To Hack Celebrity Accounts Read more: http://www.businessinsider.com/apple-fixes-security-flaw-in-find-my-iphone-software-2014-9#ixzz3C4lOFUvh,9/1/2014
This could be the Apple iCloud flaw that led to celebrity photos being leaked,9/1/2014
Apple Says It Is “Actively Investigating” Celeb Photo Hack,9/1/2014
Apple to turn newest iPhone into mobile wallet – report,9/1/2014
"FBI, Apple begin inquiries into nude celebrity photo leaks",9/1/2014
Apple iphone 6 price in Pakistan,9/2/2014
Apple iphone 5S 64GB 3G 4G Mobile Price and Specification in Pakistan,9/2/2014
Apple iTunes Login,9/2/2014
Reported Apple iCloud Hack Leaked Hundreds of Nude Celebrity Photos,9/2/2014
"FBI, Apple investigate nude photo leak targeting Jennifer Lawrence, others",9/2/2014
"FBI, Apple probe Jennifer Lawrence nude photo scandal",9/2/2014
"FBI, Apple investigate nude photo leak targeting Jennifer Lawrence, others.",9/2/2014
Apple reveals why it rejects most app requests,9/2/2014
Apple to partner with Credit Card providers to facilitate payments through iPhone 6. Let's hope it's more secure than iCloud,9/2/2014
Apple Fixes iCloud Bug Blamed for Leak of Celebrity Photos,9/2/2014
FBI - Apple begin inquiries into nude celebrity photo leaks,9/2/2014
"Apple Comments on Breach of Jennifer Lawrence, Kate Upton, and Other iCloud Accounts",9/2/2014
"Apple says The Fappening wasn't their fault, and no security breach has been found in their systems.",9/2/2014
Apple confirms celeb photo leak was the result of a “very targeted attack”,9/2/2014
Apple Denies iCloud Breach in Celebrity Nude Photo Hack,9/2/2014
"Apple: Celebrity accounts were compromised by a very targeted attack on user names, passwords and security questions, a practice that has become all too common on the Internet.",9/2/2014
Apple says iCloud wasn’t breached in celebrity photo leak.,9/2/2014
"Apple: Celeb Nudes Came From Targeted Attacks, Not iCloud Breach",9/2/2014
Apple (AAPL) Issues Media Advisory Related to Celebrity Photo Theft,9/2/2014
Apple: Celebrity photo breach not due to iCloud or Find my iPhone issues,9/2/2014
Apple patches iCloud security gap after celebrity photos hacked and leaked,9/2/2014
Apple confirms celebrities’ accounts breached in “highly targeted” attack,9/2/2014
"Apple says celebrity photo breach targeted, not due to its systems",9/2/2014
Celebrity leaks 'no breach' - Apple,9/2/2014
Celebrity photo hack: Blame Apple for its disregard for user security.,9/2/2014
Apple denies iCloud security breach in celebrity nude photo hacking,9/2/2014
Apple says its systems not to blame for celebrity photo breach | Reuters,9/2/2014
Apple: Engineers have determined that hackers breached individual accounts and didn't obtain general access to iCloud servers,9/2/2014
"Apple, Nordstrom in Talks to Partner on Payments",9/2/2014
Apple admits celebrity accounts were hacked - Technology - NZ Herald News,9/2/2014
Naked Celebrity Hacking Scandal: Apple Denies Blame for Leaked Photos ~ D' TECHWORLD.,9/2/2014
Apple Restores Customers' Confidence: No Security Was Breached In Celebrity Photo Scandal,9/3/2014
Portable Apple iPhone 5 Charger Best of its Class,9/3/2014
What Apple iPhone Portable Charger Is The Very Best For Enjoying Online Games All Day,9/3/2014
"Apple Teaming up with Master Card, Visa and American Express",9/3/2014
An Apple A Day Will Improve Your Sexual power And Satisfaction In Women,9/3/2014
Apple MacBook Pro with Retina Display | 13 inch New MacBook with OS X,9/3/2014
Apple iWatch Launching in October 2014,9/3/2014
'Fundamental flaw' in Apple iCloud,9/3/2014
"Apple iCloud security exploit is a concern, experts say",9/3/2014
Samsung turns a corner to require on Apple,9/4/2014
Apple faithful already in line outside stores to buy iPhone 6 - Neowin,9/4/2014
The World's Most Reliable Apple Analyst Just Made Some Huge Predictions About The iWatch,9/4/2014
What the Heck is Fappening with Apple (AAPL)?,9/4/2014
U.S. watchdogs accuse Chinese Apple supplier of unsafe work conditions,9/4/2014
Tim Cook Says Apple to Add Security Alerts for iCloud Users,9/4/2014
Apple to add security alerts for iCloud users,9/4/2014
All About The Apple ipad tablet - Buying It And The Ways To Make Use Of It,9/4/2014
Jennifer Lawrence photo hack: Apple to push 2-step authentication process,9/4/2014
"Amazon Ideal Portable Ipod, Apple iPhone Charger",9/5/2014
Apple Takes Steps To Prevent iCloud Hacks,9/5/2014
Apple to tighten iCloud security after celebrity leaks,9/5/2014
Here's How Apple is Improving iCloud Security After the Celebrity Leaked Photos Scandal,9/5/2014
Who is to blame when iCloud is ‘hacked’ – you or Apple?,9/5/2014
Apple to add more security measures,9/5/2014
Apple Should Be More Transparent About Security,9/5/2014
"Infamous “podcast patent” heads to trial. Personal Audio LLC has sued Apple, SiriusXM, and podcasters. CBS is up next.",9/5/2014
The Secret Apple Team That Fixes An iPhone's First Fatal Flaws,9/6/2014
Apple iPhone 6 will be so big it comes with special one handed mode,9/6/2014
Apple Can't Kill 'Breaking Bad' Fan's Lawsuit Over Final Season,9/6/2014
Apple new smartphone is soo ........... superb,9/7/2014
Apple to Add Security Alerts for iCloud Users after Celebrity Nude Photo Hack,9/7/2014
"iPhone 6 Unboxing - Hands On First Impression - Apple iPhone 6 4.7"" Screen",9/7/2014
Apple Hires Designer of Ford Concept - YourWhip Blog,9/7/2014
Chinese kit builder for Apple and Dell charges workers for water,9/7/2014
"Apple to launch much-awaited iPhone 6 tomorrow, likely to have 128 GB internal storage",9/7/2014
"This Week In Mobile: MSN Messenger Shutting Down, Apple iWatch on September 9 & Moto phones aren’t going away with Lenovo buy",9/8/2014
Hackers target Apple Mac OS X with 25 malware variants,9/8/2014
Apple iPhones among 'most stolen' handsets,9/8/2014
An Indian Summer – A Great Apple Harvest and Cone Bottom Tanks For Cider Production,9/9/2014
Huawei plant in den nächsten 5 Jahren Apple und Samsung zu überholen,9/9/2014
Cyber-thieves are exploiting the furore around iCloud by launching a phishing campaign that seeks to steal Apple IDs.,9/9/2014
Apple Plans Smartwatch and Larger iPhones,9/9/2014
Here's Your iPHONE 6 TONIGHT ♥ #APPLE LIVE,9/9/2014
This is why nobody likes you anymore apple..,9/9/2014
Apple iphone 6 live stream,9/9/2014
Live Coverage: Apple announces iPhone 6,9/9/2014
"Apple unveils the iPhone 6, the iPhone 6 Plus, AppleWatch and a new way to pay.",9/9/2014
"Apple unveils new iphone, smart watch, and payment system",9/9/2014
Apple iWatch,9/9/2014
"Apple unveils bigger iPhone 6, 6 Plus & smartwatch | TECHBLOG",9/9/2014
Apple announces the new iPhone 6/6+ and Apple Watch,9/9/2014
"Apple Releases iPhone 6 and iPhone 6 Plus Today, September 9th",9/9/2014
Analyzing the Potential of Apple Pay,9/9/2014
Apple Watch officially unveiled,9/9/2014
Apple announces iPhone 6!,9/9/2014
"Apple unveils iPhone 6, iPhone 6 Plus, Apple Watch",9/9/2014
"Apple Unveils the iPhone 6, 6 Plus, Available Sept. 19",9/9/2014
"Apple launches AppleWatch, dives into wearable market",9/9/2014
Apple needs to be cool more than it needs to make money,9/9/2014
The Apple Watch is poised to dominate the market for digital fitness trackers,9/9/2014
5 factors the actual Apple mackintosh Observe can in addition to are not able to do - Target News,9/9/2014
"$30 billion is the value that was wiped off Apple’s market value in the few hours after CEO Tim Cook unveiled the latest iPhones and the company’s “next big thing,” its Apple Watch",9/10/2014
Apple online store has formally gone down,9/10/2014
"Apple unveils iPhone 6 and iPhone 6 Plus smartphones, smartwatch",9/10/2014
Apple unveils new Watch that may change your fashion,9/10/2014
About time: Apple debuts the Apple Watch,9/10/2014
iPhone 6 Review – Why Extra Screen Size Might Ruin UX for New Apple Phone?,9/10/2014
"Apple Under Cook Takes Shape With Watch, Bigger IPhones",9/10/2014
BBC - Apple unveils Watch and new iPhones,9/10/2014
Apple’s (NASDAQ: AAPL) September Event – iPhone 6 and Apple Watch,9/10/2014
"Petition about Apple MacBook Pro failures passes 10,000 signatures | ZDNet",9/10/2014
"Apple is engaging in a 'modern-form of slavery' say experts, as users clamour for £789 iPhone 6 Plus .",9/10/2014
"Apple unveils significant i-phones, smartwatch - Target News",9/10/2014
Did Apple copy OK Go's music video concept?,9/10/2014
SPY PEOPLE LOVE the APPLE WATCH. Urge everyone to buy one.,9/10/2014
Apple Watch next to all the other smartwatches,9/10/2014
Newsmakers on Twitter love/hate Apple Watch (curated tweet commentary),9/10/2014
"U2 Appears at Apple Event, and ‘Songs of Innocence’ Appears Free on iTunes",9/10/2014
Apple to charge banks in new payment system: Bloomberg,9/10/2014
"Apple Watch Features: Design, Features and technology",9/11/2014
Apple iPhone 6,9/11/2014
"Apple announced two new iPhones, the iPhone 6 and the iPhone 6 Plus",9/11/2014
"Japan’s ‘apple watch’ is a-peeling to core fans: Manufacturing finesse, precision craftsmanship and a love of all things quirky have produced the apple watch — Japan’s real-life version.",9/11/2014
The Fashion World Reacts to Apple Watch -- The Cut,9/11/2014
Apple iPhone 6 VS Xiaomi Mi 3 Smartphones Review,9/11/2014
"OnePlus und Meizu, nehmen Apple und das iPhone 6 auf die Schippe",9/11/2014
Apple expected to sell out new iPhones opening weekend,9/11/2014
Apple iPhone6 Release… “We’ll be back”,9/12/2014
Ten Features of Apple iphone 6,9/12/2014
Apple uploads new U2 album to all iTunes accounts without 'consent',9/12/2014
Apple iPad Air.pptx download - 2shared,9/12/2014
Apple - Press Info - Letter from Steve Jobs,9/12/2014
APPLE reports record pre-orders for iPhone 6,9/13/2014
Apple Watch vs Samsung Galaxy Gear S vs Moto 360 Smartwatch Comparison Review,9/14/2014
Apple Fappening,9/14/2014
Will Apple Succeed in Dethroning Paypal with Apple Pay?,9/15/2014
"Dell, HP, Sony, Lenovo, Acer, Apple Branded Desktop Computers and Laptops - Best Price Online - Free Home Delivery - Modest Mart",9/15/2014
"September 12, 2014 - The LATEST News from Nova LifeStyle, Inc. (NASDAQ: NVFY), Apple Inc. (NASDAQ: AAPL), RadioShack (NYSE: RSH) and More!",9/15/2014
Apple outrages users by automatically installing U2 album on their devices whether they asked for it or not,9/15/2014
Apple - Press Info - Apple Announces Record Pre-orders for iPhone 6 & iPhone 6 Plus Top Four Million in First 24 Hours,9/15/2014
Samsung mocks Apple iWatch and iPhone 6! | Best Android Apps & iOS,9/15/2014
"Watch CEO to Tim Cook: Welcome Apple, Seriously",9/15/2014
Apple launches tool to help You Remove Free U2 Album You Didn’t Ask For,9/15/2014
"Apple iPhone 6, iPhone 6 Plus preorders top 4M in first 24 hours",9/15/2014
Apple releases U2-nuker,9/15/2014
Apple releases U2 album removal tool,9/15/2014
Here's how Apple came up with the Apple Watch,9/15/2014
Apple shows iTunes users how to remove U2 album,9/15/2014
leaked photo Model Joy Corrigan sues Apple over naked iCloud photo hacking,9/15/2014
"On Day 1 Apple iPhone 6, iPhone 6 Plus pre-orders hit record 4 million",9/16/2014
Reasons for App Rejection at Apple Store,9/16/2014
Apple announces record-breaking 4 million iPhones pre-ordered in just 24 hours,9/17/2014
Apple News: iPhone6 Plus Reviews,9/17/2014
A US Court Threw Out VirnetX's $368 Million Patent Infringement Award Against Apple,9/17/2014
Apple shows love for HTML5 with iOS8,9/17/2014
New Apple devices include default kill switch,9/17/2014
Rumour Has It That Apple Is Holding Back 5.5-inch iPhone 6,9/17/2014
"Sony’s struggle for existence continues to Keep up with Apple, Samsung",9/18/2014
"Apple will no longer unlock most iPhones, iPads for police, even with search warrants",9/18/2014
Finally Apple launched Apple iOS 8 operating system for their Apple products with many new and best features.,9/18/2014
Apple iOS 8: The Top Six features Of Apple iOS 8,9/18/2014
"Apple: ""We Can No Longer Decrypt iPhones for Law Enforcement, Starting with iOS 8""",9/18/2014
Understanding Apple's New Apple Pay Service,9/18/2014
CNN’s iPhone 6 app demoed during the Apple event is now available,9/18/2014
Apple says it can’t hand over iPhone data to law enforcement anymore.,9/18/2014
People begin queuing for the new IPhone 6 at the Apple store Belfast,9/18/2014
Confirmed Delivery on 9/19!! Apple Iphone 6 4.7 Inch 16gb Unlocked (T-Mobile),9/18/2014
APPLE IPHONE 6 REVIEW I CROWED AND LONG LINE TO GET.,9/18/2014
Apple iPhone 6 and iPhone 6 Plus with iOS 8 Review,9/19/2014
Four Dead in Ohio Apple Store iPhone 6 Rampage,9/19/2014
"Joan Rivers is back from the Dead, thanks to Apple",9/19/2014
"Former NBA guard Rex Chapman has been arrested for allegedly shoplifting $14,000 worth of merchandise from an Apple store in Scottsdale and then selling the items at a pawn shop.",9/19/2014
Ex-NBAer Rex Chapman allegedly stole from Apple Stores by faking EasyPay,9/19/2014
Buy Standard Cases Covers for Apple,9/20/2014
Apple releases Dead Man's Switch!,9/20/2014
Google and Apple to introduce default encryption,9/20/2014
#Apple #Watch #Review ......... that's a watch worth buying,9/20/2014
Amazon Products: Apple Iphone 6 64GB Gray Factory Unlocked GSM Phone,9/21/2014
Amazon Products: Apple Iphone 6 4.7 Inch 16gb,9/21/2014
The most effective iPhone Ever before? Apple's Most recent apple iphone Layout Is Acquiring A Bunch of Well Was entitled to News,9/21/2014
"News Of The Week (with Justin Bieber, Apple Watch and UFO above Portsmouth)",9/21/2014
Do you know why has Apple finally decided to increase the size of iPhone?,9/22/2014
"Apple sells more than 10,000,000 new iPhones in first 3 days",9/22/2014
Impervious Apple iPhone 6 Waterproofing Kits,9/22/2014
Apple sells 10 million iPhone 6 and iPhone 6 Pluses,9/22/2014
Why the Most Up to Date Apple iPhone 6 while Apple iPhone 6 Plus Are Surefire Victors,9/22/2014
Hoax ad convinces Apple fans to microwave iPhone,9/22/2014
Apple iPhone 6 Sales: Record breaking stuff,9/23/2014
Apple sells more than 10 million new iPhones in first 3 days,9/23/2014
five Methods to Improve And Reinvent The Very best Steak Sanwich Suggestions | Unlock Apple iphone four Software program,9/23/2014
Why the Most Recent Apple iPhone 6 and also Apple iPhone 6 Plus Are Surefire Victors,9/23/2014
Apple sells record 10 million iPhone6 /iPhone plus in first three days,9/23/2014
The most effective iPhone Ever before? Apple's Newest apple iphone Style Is Acquiring A Bunch of Well Was worthy of News,9/23/2014
Apple to bring out new iPads and Mac OS on October 21,9/23/2014
Apple iOS 8 Users Complain About Wi-Fi and Battery Problems,9/23/2014
Apple iPhone 6 New Characteristic and also Reasons You Ought to Obtain One,9/23/2014
Bend-gate: Apple iPhone 6 Plus found bending in pants pockets,9/23/2014
"BREAKING: Reginald Humphrey Aka ""The Cinnamon Apple Guy"" kills girlfriend over ""Man Crush Monday""",9/23/2014
"Costing $200 to make, the iPhone 6 should offer big profits for Apple",9/23/2014
Samsung to launch new phone in China before Apple,9/23/2014
Apple iPhone 6 and iPhone 6 Plus Shattered All Records With a sale of 10M,9/24/2014
Samsung has a bigger problem than Apple,9/24/2014
"It costs Apple only $243.74 to manufacture an iPhone 6, meaning a price markup of 500%. Apple has sold 10 million handsets in just 3 days.",9/24/2014
Apple Support’s Response to #Bendgate,9/24/2014
Apple fans' tight pants are bending the iPhone 6 Plus,9/24/2014
"One whistleblower gets $30m in the bank, but others count the personal cost --""It’s not every day that you get to buy an iPhone from an ex-NSA officer. Yet a number of people visiting the Washington metro-area Apple store get to do just that.""",9/24/2014
Apple pulls OS 8.0.1 after users report major problems with update,9/24/2014
Apple customers discover unexpected flexibility in iPhone 6 Plus,9/24/2014
Apple pulls iOS 8.0.1 update after users report major issues,9/24/2014
Apple pulls iOS update after widespread reports of disabled phones,9/24/2014
Bad Month for Tim Cook and Apple,9/24/2014
Apple Pulls Buggy iOS 8 Update Just After Releasing It,9/24/2014
Apple Pulls iOS Software Update,9/24/2014
Apple Knew About iCloud Security Flaw Months Before Celebrity Nude Photo Hack,9/25/2014
Apple Sells 10 Million iPhone 6 And 6 Plus Devices During Launch Weekend,9/25/2014
Apple yanks iOS 8 update after series of snafus,9/25/2014
Apple apologizes for iOS 8.0.1 update screw up !,9/25/2014
"Wall St. drops on Apple weakness, dollar concerns",9/25/2014
Apple iPhone 6 New Characteristic while Reasons You Need to Obtain One,9/25/2014
"Apple: Bending in iPhone 6 Plus From Normal Use 'Extremely Rare', Only 9 Customers Have Complained",9/25/2014
Apple stock gets hit on 'Bendgate',9/25/2014
Apple says cases of bent iPhones 'extremely rare',9/25/2014
"FBI Director James Comey 'Very Concerned' About New Apple, Google Privacy Features",9/25/2014
Apple knew of iCloud API weakness months before celeb photo leak broke. Security researcher reported brute force attacks were possible in March.,9/25/2014
"FBI blasts Apple, Google for locking police out of phones",9/25/2014
Apple loses $23 Billion since iPhone 6,9/25/2014
"Apple, Google default cell-phone encryption “concerns” FBI director",9/25/2014
Apple releases iOS 8.0.2 to fix iPhone 6 bending bug.,9/25/2014
Apple stock Down due to iOS Problems and this Video,9/25/2014
Apple releases iOS 8.0.2 update to fix issues on iPhone 6,9/26/2014
Easy Keratosis Pilaris Apple Cider Vinegar Remedy,9/26/2014
Apple Reveals Its Own iPhone Stress Tests,9/26/2014
How Green Is Apple? Environment Talk Lasts 18 Sec In 2-Hour iPhone6 Unveil,9/26/2014
Apple iPhone 6 vs Apple iPhone 6 Plus,9/26/2014
"John J. Escalante, chief of detectives for Chicago's police department, believes that ""Apple will become the phone of choice for the pedophile.""",9/26/2014
