text,Date
Find Winning Trades… with Emphasis on Stocks in the Apple Ecosystem,12/22/2014
Multi usb charger apple,12/22/2014
Buy Apple iPad Air 2 in India,12/23/2014
Apple pushes first ever automated security update to Mac users,12/23/2014
"Apple working with Intel And trying to make super fast processor, 100 millions fine.",12/26/2014
News and Insights on the Apple universe,12/26/2014
Apple Has Declined to host The Interview on itunes on request of sony pictures,12/26/2014
BID on a brand new Apple Macbook Pro Now!,12/27/2014
"First Time Ever Apple Automatically Pushes Security Patch for Mac OS X Mountain Lion v10.8.5, OS X Mavericks v10.9.5, OS X Yosemite v10.10.1 -update in the Mac App Store.",12/28/2014
The interview movie bagged $15million and now available on Apple itunes.,12/28/2014
Apple likely to unveil ‘mini’ handsets of its flagship iPhone in 2015,12/30/2014
New York City ponders bitcoin and Apple Pay for parking tickets,12/31/2014
Apple Won Christmas By A Landslide This Year,12/31/2014
Security Issue Prompts Apple,12/31/2014
Latest Snowden Revelations Expose Scope Of NSA InterceptionsLatest Snowden Revelations Expose Scope Of NSA Interceptions and provides the catalysts for launching Anonygo on the apple App Store,12/31/2014
Apple sued for shrinking storage space on 16GB devices thanks to iOS 8,1/1/2015
"Apple facing lawsuit for false advertising of iPhones, iPads, and iPods.",1/1/2015
"Apple sued over iPhone, iPad storage",1/1/2015
Apple is facing a lawsuit for not telling users about the amount of memory required by iOS8,1/2/2015
Apple sued over 'shrinking' gadget storage,1/2/2015
Apple & Facebook to partner on diabetes treatment?,1/2/2015
American Users Sue Apple for Misleading with The Storage in iOS8,1/2/2015
Apple sued over iOS 8 storage demands,1/3/2015
New update that will put Apple to shame,1/3/2015
"iPhone owners sue Apple over storage space, allege fraud",1/4/2015
"Apple Shares Testing Major Support Again – Jan 5, 2015",1/4/2015
Apple pushes out first-ever silent security update to Mac OS X user,1/5/2015
Putting Apple to shame,1/5/2015
5 Reasons Why Ako Ako is Putting Apple To Shame,1/5/2015
Apple patents flexible iPhone and smart glasses,1/6/2015
Apple - iPhone 6 (Reviews),1/6/2015
EMF Radiation Soeks Impulse Apple MacBook,1/7/2015
Monster Sues Apple Unit Headphone Deal,1/7/2015
Apple is testing a new super-thin MacBook Air.,1/7/2015
<b>iPad</b> Air Plus Specifications And Features: Will Apple Launch Device This Year?,1/7/2015
Cómo activar doble autenticación en iCloud y otros servicios de Apple,1/8/2015
"Apple products and innovations have led to over 1 million U.S. jobs — from engineers and retail employees to suppliers, manufacturers, and app developers.",1/8/2015
12 Crazy Ways Apple Could Spend Its Massive War Chest,1/8/2015
"Apple factory workers routinely abused, exploited by corporate greed - BBC investigation - NaturalNews.com",1/8/2015
Apple said to kick off selling unlocked iPhone 6 and 6 plus in the US,1/9/2015
"Apple Inches towards Bitcoin, Approves a retro-styled iOS game that tips players in Real Bitcoin",1/9/2015
"Apple Introduces SaruTobi, an IOS Bitcoin Game",1/9/2015
NEW MOBILE ZONE: New Year Eve 2015 Ball Drop Apple iTunes app (screen shot)Apple iTunes screen-shot,1/10/2015
How Retailers Like Apple Mess With Our Senses to Boost Sales (Infographic),1/11/2015
California apple plant linked to deadly listeria outbreak: FDA | Newsweep.com,1/11/2015
Short-Term Reversal Pattern on Apple Shares,1/12/2015
Apple Has Patched A Hole In iCloud That Let Hackers Access Anyone's Account,1/12/2015
What's Coming From Apple in 2015,1/13/2015
Sell Apple iPhone: Sellsmartforcash.co.uk,1/13/2015
Apple Granted a Patent for a Superior GoPro-like Camera System,1/13/2015
Motorola set to announce new line up 1-26-2015 Apple Style. New Smartwatch? Flagship Tablet?,1/13/2015
Bally Chohan Technology Review- Apple IOS 8,1/13/2015
Genuine Apple 18.5V 4.6A Laptop Charger UK B005WTC1RY,1/14/2015
"Apple patents camera, and GoPro shares tank",1/14/2015
"Apple, Google Reach New Settlement in High-Tech Wage Case",1/14/2015
"After 11 years, Apple quietly ends free iTunes 'Single of the Week'",1/14/2015
"Apple patents mountable sports camera, and GoPro shares tank",1/14/2015
"Apple is Going to Ditch Intel Processors, Will use ARM Based 64-bit Processors",1/15/2015
"Apple, Google settle U.S. poaching lawsuit for $415 million",1/15/2015
Latest from Cynthia at Apple Vacations,1/15/2015
syntelli1's Profile | Apple Support Communities,1/15/2015
Google and Apple in settlement offer,1/15/2015
"Apple, Google settle U.S. poaching lawsuit for $415 million | Reuters",1/16/2015
$739.99 NO Tax Apple iPhone 6 64 GB Unlocked,1/16/2015
Apple sues Ericsson over LTE wireless telecom patents,1/16/2015
Official Bypass iCloud Activation Lock Permanent iOS 8.1.3 to Remove Unlock iOS 8.2 iCloud Lock from Apple Database Servers | How To Download Cydia,1/18/2015
Apple Cider Vinegar For Hair Treatment,1/18/2015
Apple iPad Pro could come with a stylus: Report,1/19/2015
Latest iPad Air by Apple is Ready For Personal Pickup,1/20/2015
Edward Snowden says secret Apple spyware is the reason he won’t use an iPhone,1/20/2015
Snowden doesnt use Apple due to spyware on phone.,1/20/2015
"Apple Reveals the List of Most Downloaded Paid, Free and Grossing iOS Apps of 2014",1/21/2015
Amazon Joins Apple Using Clean Energy at Cloud Data Centers - Apple Inc. powers all of its data centers with renewable energy and Google Inc. (GOOG) gets 35 percent of the power needed to run its operations from solar panels and wind turbines,1/21/2015
Coimbatore-Apple-Advertising-Services--Ramnagar,1/23/2015
Edward Snowden: Apple iPhone With Secret iFeature Allows Government to Spy on You,1/25/2015
Missouri Lawmaker Doesn't Understand Apple Pay and Wants to Require a Driver's License,1/25/2015
The Apple Watch 2015,1/26/2015
Apple has sold more iPhones in China than in the US,1/26/2015
"Google Joins Apple, Others Cutting Off Crimea, Blocks AdWords, AdSense, Google Play",1/26/2015
Apple Makes Piracy Legal (kinda),1/26/2015
Apple Launches Retina iPad Mini And Thinner iPad 5 Today,1/27/2015
Android 5.0 L Vs Apple iOS 8: Which Platform Will Lead the Market In 2015?,1/27/2015
"Apple Releases iOS 8.1.3, Here are the Download Links For iPhone, iPad and iPod touch.",1/27/2015
"Il team di Google Project Zero ha colpito Microsoft parecchie volte con rivelazioni sulla vulnerabilità nei software Windows, ma adesso è il turno di Apple.",1/27/2015
"Apple obliterates expectations, selling 74.5M iPhones & earning $18B in profit, US corporate record.",1/27/2015
Apple's profit was a record $18 billion this last quarter. That's 3 Apple Nimitz-class supercarriers cruising the high seas. In one quarter.,1/27/2015
Apple profit 'biggest in history',1/28/2015
Apple releases OS X Yosemite 10.10.2 update - Maati,1/28/2015
Apple Watch starts shipping in April : Tim Cook,1/28/2015
"Apple posts $18 billion profit, the largest in its history",1/28/2015
Apple Watch to Ship in April,1/28/2015
"The success in China helped push Apple to a blockbuster first quarter, increasing overall profit to $18 billion and revenue to $74.6 billion",1/28/2015
Apple posts the biggest quarterly profit in history,1/28/2015
Apple Posts Whopping $18B in First Quarter Profits,1/28/2015
"Apple ""to pay every American $556""",1/28/2015
Apple has enough cash on hand to buy Lithuania. Three Times.,1/28/2015
Apple Watch Release Date Set for April,1/28/2015
Apple rings up big holiday sales thanks to larger-screen iPhone 6,1/28/2015
Growing Apple fruit trees from seeds,1/29/2015
Apple announces $18B profit for Q1 2015 - Maati,1/29/2015
Apple records the largest profit of any company in history.,1/29/2015
Apple makes more money every 3 weeks than the entire recorded music industry does in a year,1/29/2015
Apple iPhone's Global Sales Overview from Q3 2007 to Q1 2015.,1/29/2015
Apple Watch. Tesla Car. How Far Can We Drive Them?,1/29/2015
4 Products of Apple that might rock the market,1/29/2015
New apps better than Apple,1/30/2015
How and Why Apple overtook Microsoft,1/30/2015
Apple Reveals the Best iOS Apps of 2014,1/30/2015
Samsung Apple Back In Dead Heat for Global Dominance,1/30/2015
"Bocah 15 Tahun Dilirik Apple, Google dan Facebook",1/30/2015
Apple new watch!,1/31/2015
The AAPL Effect: Q4 Earnings Growth Without Apple: 0%; With Apple: 2.1%,1/31/2015
Ex-Suns guard Rex Chapman accused of stealing $14K in Apple merch,2/1/2015
"Apple to store your fingerprints in the cloud, ripe for hackers and NSA surveillance",2/1/2015
Apple announces $2B global command center in Arizona,2/2/2015
Apple avoids US taxes by issuing $6.5B in bonds rather than bringing home funds from $157B held by foreign subsidiaries,2/2/2015
Apple to invest $2 billion to convert sapphire plant to data center,2/2/2015
How to control the video playback with Apple Remote?,2/2/2015
Best Football Apss on IOS Apple & android,2/3/2015
Bruce Willis to fight Apple over right to leave iTunes library in will | Film,2/3/2015
Is this where App Store ratings actually come from? | Apple | Geek.com,2/3/2015
Apple taps minority firms in bond deal http://usat.ly/1CWL89x,2/3/2015
Reuters: more than half of top US hospitals are running Apple HealKit trials,2/5/2015
Apple may be launching new online subscription TV service,2/5/2015
"Wegmans tops Amazon, Samsung, Apple and Google in reputation, Harris Poll finds.",2/5/2015
Apple employees deflect to Tesla,2/6/2015
Swatch to Face Off Against Apple Watch http://news.discovery.com/tech/gear-and-gadgets/swatch-to-face-off-against-apple-watch-150206.htm,2/6/2015
Samsung DID NOT try to pay Apple $1 billion in nickels.,2/8/2015
Convert Blu-ray for Apple TV 3,2/8/2015
Why Apple Pay Isn't the Be-All and End-All,2/9/2015
Rumors: Apple Planning To Ditch Google With It’s Own Search – Can It Be A Google Killer?,2/9/2015
Elon Musk Has Raided 150 People From Apple For Tesla,2/9/2015
Apple employee: We're working on something that will 'give Tesla a run for its money',2/9/2015
Apple employee: We're working on something that will 'give Tesla a run for its money'.,2/9/2015
Apple Watch and the iPhone Era,2/10/2015
Technology News - Apple Planning Own Search Engine To Overtake Google?,2/10/2015
Is Electric iCar Finally Coming From Apple?,2/10/2015
Apple becomes first company worth $700bn | Technology,2/10/2015
Apple Closes at Record Market Value of More Than $700 Billion,2/10/2015
Tim Cook's big day: Apple hits $700 billion,2/10/2015
Apple sets US record with market value above $700 billion,2/10/2015
Apple Becomes First US Company to Have $700 billion Fortune. | iTechbee,2/11/2015
Apple is investing $850 million to build a giant solar farm that will power its new headquarters,2/11/2015
Apple Building Solar Farm to Power California Operations,2/11/2015
Apple Clinches $850 Million Deal With First Solar for Renewable Energy - The agreement is the largest in the solar industry for a single commercial customer,2/11/2015
REE: Apple Investing $850 Million In California Solar Farm.,2/11/2015
"Electric iCar Is For Real? ""Proof is here: Apple Is Building an Electric Vehicle.""",2/11/2015
"Apple, a company once near bankruptcy and who survived only because of help from Microsoft, just had their market cap be greater than Google and Microsoft combined.",2/11/2015
Tim Cook is going to the White House to debate whether Apple products are helpful to criminals.,2/11/2015
"iPhone thefts down thanks to Apple ""kill switch""",2/11/2015
Apple is now worth more than Microsoft and Google combined,2/11/2015
"While Apple chose Solar, Google taps Wind Power to offset its electrical consumption",2/12/2015
"On JetBlue, Passengers Can Use Apple Pay",2/12/2015
Elon Musk Thinks Tesla Will Be As Big As Apple In 10 years.,2/12/2015
"Apple added an activation lock that enables people to wipe and disable their stolen phones in September 2013. Since then, the New York Police Department has seen a 16 percent drop in cell phone robberies, and a 25 percent drop in people grabbing iPhones specifically.",2/12/2015
"Google gives Apple and Microsoft an ultimatum: 'Patch your software vulnerabilities, or we'll make them public'",2/12/2015
Apple Backslides on Work-Hour LimitsA quarter in which Apple sold an enormous number of iPhones also saw compliance with workweek rules decrease.from BWCWeb http://bits.blogs.nytimes.com/2015/02/12/apple-backslides-on-work-hour-limits/?_r=1,2/12/2015
Apple bans worker 'bonded servitude',2/12/2015
This is the Apple iPhone 6 that no girl can refuse,2/13/2015
Google Wallet expands to kill your credit card and Apple Pay,2/13/2015
Easy Crock Pot Apple,2/13/2015
Lithium High: CNET Apple Byte - Apple's Next Big Thing ... The Apple Car?,2/13/2015
U.S. approves biotech apple that resists browning,2/13/2015
New genetically modified apple that doesn’t brown when cut open or bruised finally has been cleared to be grown in the U.S.,2/13/2015
Cybersecurity Summit Exposes Silicon Valley’s Privacy Fears with Apple CEO Tim Cook delivering a blistering critique,2/13/2015
Apple preparing electric vehicle to take on Tesla,2/13/2015
An Apple car? Computer firm hires automotive engineers,2/13/2015
"Apple has 'several hundred' workers designing new electric car, codenamed 'Titan' - report",2/13/2015
Apple Said to Be Working on Electric Car to Challenge Tesla,2/13/2015
Apple Mobiles Pakistan – Apple Mobile Prices Pakistan,2/14/2015
Is Apple Working On An Electric Car? | Gadgetgoof,2/14/2015
Apple learning to make self-driving car: source,2/14/2015
"Canadian Solar (CSIQ) Stock Surges Today in Wake of Apple, First Solar Deal",2/14/2015
"Report: Apple has “several hundred” staffers building an electric car -- This news comes roughly a year after Tesla founder Elon Musk confirmed that he had held ""conversations"" with Apple, but he wouldn't confirm anything about plans or suggestions that his company be acquired",2/14/2015
Apple Might Be Working On An Electric Car,2/14/2015
"Apple Is Making An Electric Car, And It's A Minivan, Report Says",2/14/2015
"Apple is Building a Self-Driving Car, Says Reuters",2/14/2015
Apple plans to develop electric car,2/14/2015
Apple Car New Revolution,2/14/2015
"Obama, Apple Rally Business With Cybersecurity Order",2/15/2015
"Apple Inc. is in the process of hiring automotive technology experts, set to work out of the company’s secret facility in Cupertino, Calif. to potentially develop a car.",2/15/2015
No more brown apples? The USDA will deregulate two apple varieties genetically engineered to resist browning,2/15/2015
"Government Wants ""Backdoor"" to Apple and Google Encryption. This and Other Tactics Unpopular with Tech Giants.",2/15/2015
Is Apple Set To Make Electric Car?,2/16/2015
Apple gearing up to build an 'iCar' - Blog,2/16/2015
"Media calls Oxidation ""Browning"" to Demonize it and promote the new genetically modified apple",2/16/2015
Exclusive: The upcoming Samsung Galaxy Tab S2 will be thinner than the Apple iPad Air 2,2/16/2015
Apple To Power New Headquarters With Solar Energy,2/16/2015
Apple car? New road emerging for tech,2/16/2015
Apple reverses decision to block marijuana app | Newsweep.com,2/17/2015
Apple is preparing to buy Tesla Electric Car manufacturer,2/17/2015
Apple May Be Working On A Self-Driving Electric Car ~ Technologies Site,2/17/2015
User Mohanprasad | Submitted the link of all Apple Service Center,2/18/2015
Apple Inc. To Buy Tesla For $75 Billion In 18 Months: Calacanis,2/18/2015
"Samsung Buys LoopPay, a Competitor to Apple's Mobile WalletThe move comes just a few months after the release of Apple Pay, Apple’s mobile payments product.from BWCWeb http://bits.blogs.nytimes.com/2015/02/18/samsung-buys-looppay-a-competitor-to-apples-mobile-wallet/?_r=1",2/18/2015
First GMO apple approved for sale by the USDA; says approval doesn't mean it is safe for human consumption,2/18/2015
Apple sued for poaching engineers with deep expertise in electric car systems,2/19/2015
Apple Electric Car: Could An iCar Be Coming?,2/19/2015
Should Automakers Be Afraid Of An Apple iCar And Why Not Just Buy Tesla?,2/19/2015
Apple sued for poaching car battery engineers,2/19/2015
StarTech.com 1-Feet Coiled Black Apple 8-Pin Lightning to USB Cable for iPhone iPod iPad 3/4 (USBCLT30CMB),2/19/2015
Apple Wants to Start Producing Cars as Soon as 2020,2/19/2015
Apple is aiming to get an electric car rolling on the streets in five years,2/19/2015
Apple Wants To Begin Production Of Electric Cars By 2020,2/19/2015
Auto Team is Forming at Apple,2/19/2015
Electric iCar: Apple Sued by Advanced Lithium Battery Maker on Several Counts.,2/20/2015
Apple Wants to Start Producing Electric Cars as Soon as 2020.,2/20/2015
Apple to start the production of ‘iCar’ in 2020,2/20/2015
This week's mythical creature: the Apple Car,2/20/2015
Apple car has pitfalls but leverages competency,2/20/2015
Can Apple Make The Leap From iPhone To iCar? Is The Partnership With Tesla Coming?,2/21/2015
Apple Wants You To Help In The War On iOS Bugs,2/21/2015
TECNOLOGIA: Apple deve lançar carro elétrico até 2020 - É notícia,2/21/2015
"""Apple"" offering free repairs for computers ""MacBook Pro""",2/22/2015
BBC - Future - Could Apple really be about to make cars?,2/22/2015
"#KOT #Apple has a new commercial out for the IPad Air 2 for the #Oscars2015 ""Make your films with IPad Air2""",2/22/2015
Best Apple Repair Service Provider in San Diego,2/23/2015
Apple iPhone 6 Plus,2/23/2015
"Tesla, Google, Apple: is Silicon Valley the future of the US car?",2/23/2015
A few more good arguments against the Apple Car--and a lousy one in its favor,2/23/2015
Apple invests 1.7bn euros in centres | Newsweep.com,2/23/2015
Apple Is Now More Than Double the Size of Exxon—And Everyone Else,2/23/2015
"Department Of Agriculture Approves First Genetically Modified Apple, Which Resists Turning Brown",2/23/2015
Google Wallet to fight Apple Pay and PayPal with Softcard revamp,2/24/2015
The Apple/Tesla Dream Team,2/24/2015
Samsung Galaxy S6: Likely Features to Challenge Apple iPhone 6 Line,2/24/2015
Apple pouring 1.7 billion euros into new data centers in Ireland and Denmark,2/25/2015
Apple Told by Jury to Pay $532.9 Million in Patent Trial,2/25/2015
"China drops Cisco, Apple and Intel from its approved state purchase lists",2/25/2015
Apple Ordered to Pay $533M in iTunes Patent Suit,2/25/2015
The Apple Electric iCar: What You Need to Know.,2/25/2015
Apple Ordered to Pay $533M in iTunes Patent Case,2/25/2015
Apple and Google still not removing dangerous health app being used by patients,2/25/2015
Apple Shares Show Signs of Retracement,2/26/2015
Apple fined $553 million for patent infringement,2/26/2015
Cyankart - Buy Apple iPhone 6 Cases Online in India,2/26/2015
"Company with no product wins $533M verdict vs. Apple, says it’s no “patent troll”",2/26/2015
"Apple Plans ‘Special Event’ on March 9, Likely for Smartwatch",2/26/2015
Apple Watch event announced for March 9th,2/26/2015
Apple Ordered to Pay $533 Million for Patent Infringement,2/26/2015
"Intel, Apple and Cisco crossed off Chinese Gov's kit list",2/26/2015
Android App Beats Apple Pay to Secure Bitcoin Mobile Payments,2/27/2015
"Ericsson seeks US iPad, iPhone ban as it sues Apple over patents",2/27/2015
"Ericsson Sues Apple Over Patent Licensing, Seeks To Block iPhone And iPad Sales",2/27/2015
"Ericsson seeks US sales ban of Apple iPhone, iPad in patent lawsuit barrage",2/27/2015
Tecnologia: Site diz que Apple e Google podem 'escutar' tudo o que você diz no celular - É notícia,2/27/2015
Christian College Student Attacked With Apple for Questioning Treatment of Gays,2/27/2015
Apple Valley semi driver who roared past school bus gets year in jail,2/27/2015
Apple Begins to Roll Out Concierge to Address Customers' Issues Instantly,2/28/2015
Apple iPad 4th Generation,2/28/2015
Apple chief hits out at online snoopers saying governments and companies have no right to spy on emails and personal data,2/28/2015
How Apple lost $533 million to an 8th-grade dropout patent troll,2/28/2015
Apple Watch will replace car keys: Tim Cook,3/1/2015
Apple ordered to pay $532.9 million to a 8th-grade dropout patent troll,3/1/2015
Apple Watch will replace your car keys - says CEO of Apple,3/1/2015
"Apple, Yahoo bus drivers vote to unionize",3/1/2015
Iconic Apple brand could be a threat to Detroit automakers,3/2/2015
IS APPLE CIDER VINEGAR GOOD FOR DOGS?,3/2/2015
Apple announces March 9 event for the Apple Watch - Maati,3/2/2015
Apple Jumps Into the Alternative Fuel Fray,3/2/2015
Electric iCar: Apple Adds Vehicles To Its List Of Company Activities In Swiss Legal Filing.,3/2/2015
The Apple Watch – Will it get Smashing Success and Adoption?,3/3/2015
Fraud Comes to Apple Pay - Digits,3/3/2015
Apple and Google Plan Fixes for 'Freak' Security Bug,3/3/2015
"As much as 1,500 gallons of used motor oil leaked from an above-ground storage tank in Washington state into a creek that flows into the Yakima River, vital to the apple-growing state's agricultural hub.",3/3/2015
Apple exploring settlement with electric car battery maker,3/4/2015
Apple and Google 'FREAK attack' leaves millions of users vulnerable to hackers: Technology giants hurrying to fix a longstanding security flaw caused by US companies being forced to sell weakened encryption software to overseas customers.,3/4/2015
Fraudsters using Apple Pay to load up stolen card info,3/4/2015
"Judge OKs $415 million no-poaching payout to Apple, Google employees | Ars Technica",3/4/2015
"For the first time in three decades, unemployment fell in every state and the District of Columbia last year. The last time that happened, in 1984, Apple was unveiling the original Macintosh.",3/4/2015
"Apple Beats Samsung in Global Smartphone Sales, Says Report",3/5/2015
“FREAK” flaw in Android and Apple devices cripples HTTPS crypto protection,3/5/2015
"Apple, Google Said to Be in Talks With HBO to Carry Web Channel",3/5/2015
"“HBO Now” coming this spring for $15 per month, with Apple as launch partner",3/5/2015
HBO In Talks With Apple To Be Launch Partner For Coming Web Service 'HBO Now',3/5/2015
"Apple Suppliers Told to Produce Larger-Screen iPad. Cupertino, Calif., company’s plan comes as its tablet sales continue to decline",3/5/2015
Apple may be planning a waterproof iPhone,3/5/2015
"Facebook, Apple among 379 that file to support gay marriage",3/6/2015
Apple Will Replace AT&T in the Dow Jones Industrial Average,3/6/2015
Apple to join dow jones,3/6/2015
Apple to replace AT&T in the Dow Jones Industrial Average,3/6/2015
Apple To Replace AT&T In Dow Jones Industrial Average,3/6/2015
Powered By Lithium: Apple Goes Full Speed Ahead on Electric Car by 2020.,3/6/2015
Apple Inc and Google Inc said on Tuesday that they have developed fixes to mitigate the newly uncovered 'Freak' security flaw affecting mobile devices and Mac computers,3/6/2015
"Apple, Facebook, Comcast, and hundreds of others ask Supreme Court for nationwide marriage equality",3/6/2015
"Apple knocks AT&T out of the Dow, cementing the iPhone maker's dominant position in the economy.",3/6/2015
"Apple Inc (AAPL.O), the largest U.S. company by market value, will join the Dow Jones industrial average .DJI, replacing AT&T Inc (T.N), in a change that reflects the dominant position of the iPhone maker in the U.S. economy and society.",3/6/2015
"Apple to FINALLY join Dow. It's about iTime! The most valuable company on the planet, is finally getting the recognition it deserves from the people that run the world's most well-known stock market index.",3/6/2015
Samsung Takes on Giant Apple Inc.,3/6/2015
Apple reportedly working on a 12-inch MacBook Air with Retina Display - Maati,3/6/2015
"Apple Will Join Dow Jones Industrial Average, Replace AT&T",3/7/2015
Zeaplus plan to knock off the Apple Watch with $69 price tag,3/8/2015
Apple Cake,3/8/2015
Apple is investing $850 million in a solar energy farm,3/8/2015
How the Apple Watch Might Make Us Dumber,3/8/2015
Apple to release public betas of future iOS releases - Maati,3/9/2015
What Could Make or Break the Apple Watch,3/9/2015
Apple set to hold Apple Watch event,3/9/2015
Available to download now across Android and Apple platforms on both Mobile and Tablet devices,3/9/2015
Forget the Apple Watch. Pocket watches are making a comeback.,3/9/2015
"Apple iPad 4th Generation 64GB, Wi-Fi + 4G Cellular (Sprint), 9.7in",3/9/2015
"HBO just announced its stand-alone service, which is exclusively available only on Apple devices",3/9/2015
Apple wants your iPhone to double as a medical device,3/9/2015
HBO Web-Only Service to Debut April on Apple Devices First,3/9/2015
"Apple unveils new, 12-inch MacBook, in gold/silver/gray color options, starting at $1299",3/9/2015
Apple Watch entry model starts at $349 for smaller version,3/9/2015
HBO Now will Exclusive to Apple Devices.,3/9/2015
Apple Watch is the first new gadget since Steve Jobs,3/9/2015
Apple Unveils Apple Watch,3/9/2015
HBO Exclusively on Apple,3/9/2015
Apple Watch Release Date Set!!!,3/9/2015
"HBO Now, HBO's upcoming streaming service, will only be available on Apple devices.",3/9/2015
The Apple Watch will be a giant flop,3/9/2015
"Apple Watch Edition Costs Upwards of $10,000",3/9/2015
Apple’s Watch Reveal Features Marathoner Christy Turlington Burns: Why The Apple Watch Is Ideal For Runners,3/9/2015
"APPLE WATCH pricing was announced earlier today. APPLE WATCH Edition will start at $10,000 with the most expensive one going for $17,000.",3/9/2015
Apple lands HBO streaming service as a launch exclusive,3/9/2015
"How good actually is the new Apple watch, and why should we care?",3/9/2015
"Apple Watch Marketing Pitch: Apple just shamelessly appropriated African poverty and maternal health issues to sell us a $10,000 18-karat gold watch... the day after International Women's Day. :/",3/9/2015
How I feel about the latest Apple keynote,3/9/2015
