text,Date
Apple iPhone 4 details specifications and market price. - Details Specification,8/6/2015
Apple Music Has More Than 11 Million Trial Members Since June Launch : PERSONAL TECH : Tech Times,8/6/2015
Apple iPhone 4s details specifications and market price. - Details Specification,8/6/2015
Apple iPhone 5 details specifications and market price. - Details Specification,8/6/2015
Apple iPhone 5s details specifications and market price. - Details Specification,8/6/2015
Apple iPhone 5c details specifications and market price. - Details Specification,8/6/2015
Nobody is using Apple Music,8/7/2015
Apple iPhone 6 Plus details specifications and market price. - Details Specification,8/7/2015
Is it time to ditch Apple for Microsoft?,8/7/2015
"Apple pay $700,000 a year for Tim Cook's security",8/8/2015
Apple ‘iPhone 6s’ rumor roundup,8/8/2015
"Apple Rumors: The Likely, the Unlikely",8/8/2015
New York murder rate surges 10 per cent: Mayor of the Big Apple says police need to address rise in violent crime,8/8/2015
News Apple MacBook Air 2016 Update : Mouse & Trackpad To Get Biometric Upgrade Too? - The Technology Zone,8/9/2015
Apple is Slipping in a Universe Where Success Is Relative,8/9/2015
Apple is Beginning to Slip. Learn More.,8/9/2015
Apple iPhone 7 Official Concept Features SEE IT NOW !,8/10/2015
"Nebia, a Shower Head Start-up, Receives Funding From Timothy Cook of Apple",8/11/2015
Does Apple Want a 'Terminator' as It Patents New Liquid Metal for Manufacturing,8/11/2015
Living with an Apple Watch,8/11/2015
Apple Shares Tumble 5% Amid China Concerns,8/11/2015
"Your Security is Just Dandy, Apple Pay, but Here Comes Android",8/12/2015
Apple Pay Competitor CurrentC May Not Launch Until Next Year,8/12/2015
Apple Watch Türkiye'de!Daha Fazla Bilgi,8/13/2015
Apple says hired 65% more women in the past year,8/14/2015
Documents confirm Apple is building self-driving car,8/14/2015
Apple car IS being built,8/15/2015
Inside the abandoned military base where Apple reportedly wants to test its top-secret car,8/15/2015
This Apple employee is so secretive he signs his emails with a question mark,8/15/2015
Apple will not release an iPad Air 3 this year,8/15/2015
Apple invention automatically shares photos based on facial recognition data,8/16/2015
"Costa Mesa woman accused of stealing, selling $732,000 in Apple products",8/17/2015
Apple is working on a new mouse and new keyboard,8/17/2015
Apple annuncia il Music Festival 2015,8/18/2015
Apple Mac Technical Support Phone Number +1-800-506-9828,8/18/2015
Apple Says A Lot Of People Are Still Using Apple Music,8/18/2015
Samsung Pay: how does it differ from Apple Pay?,8/19/2015
Apple is going to introduce it's electric car,8/19/2015
"People are giving up on Apple Music, survey says - 48 percent of Apple Music trialists have stopped using the service, but Apple has denied that claim",8/19/2015
Follow Apple Mac Technical Support crowdfunder,8/20/2015
Gold color Apple shaped clock,8/20/2015
Apple Technology Company launches “benchmark” in Australian dollar corporate bond issue,8/21/2015
Apple iPhone 5S case,8/21/2015
Apple Company Jobs,8/22/2015
Landslide near Shoghi blocks Shimla highway – travelers and apple trucks stranded,8/22/2015
Apple iPad Air 2 Giveaway,8/23/2015
Apple Recalls Batch of iPhone 6 Plus Smartphones,8/24/2015
Follow Apple Mac Technical Support On list-company.com,8/24/2015
Apple Recalls Some iPhone 6 Plus Models Over Blurry Photos,8/24/2015
Apple CEO Tim Cook may have violated SEC rules with Jim Cramer email,8/24/2015
Thieves Steal Apple Computers From A Middle School | ESF,8/24/2015
"Apple iPhone 9 Images, Release Date, Features, Video",8/24/2015
Tim Cook to announce Apple education program for public schools today,8/25/2015
Apple Shares up 6.5% during pre-market after Black Monday's loss,8/25/2015
Apple TV goes down at fourth place even behind the Fire TV from Amazon,8/25/2015
Apple Mac Technical Support Phone Number - Business Insurance,8/25/2015
"iPad Mini, a grande sacada da Apple",8/25/2015
Find Apple Service,8/26/2015
"What is Apple iBeacons Technology, its purpose and uses ?",8/26/2015
Apple iPad Support,8/26/2015
Apple iPad Mini Support,8/27/2015
Apple iPhone Support,8/27/2015
Apple iTunes Support,8/27/2015
Apple Mac Mini Support,8/27/2015
Apple OS X Snow leopard support,8/27/2015
Apple OS X Lion Support,8/27/2015
Apple Watch A Fascinating Toy BY Swatch,8/27/2015
NEWS: Apple Event Scheduled for Sept 9,8/27/2015
Here's When Apple Is Unveiling the Next iPhone,8/27/2015
Apple to unveil new iPhones in September,8/27/2015
Apple sẽ ra mắt iPhone 6S vào 9/9 tới - Game Net - Lắp đặt phòng Game Net - Tư vấn lắp đặt Game Net tại Hà Nội,8/28/2015
Apple Pay For Everyone! PayAnywhere Mobile Reader Hits Apple Stores in September,8/28/2015
"Apple Sends Out Invitations for Sept. Event, New iPhones to be Revealed",8/28/2015
"Pentagon Teams up With Apple, Boeing to Develop Wearable Tech",8/28/2015
Apple in San Francisco,8/28/2015
Key Apple music exec steps down,8/28/2015
Apple Music Exec Ian Rogers Quits,8/28/2015
Reading The Apple Event Tea Leaves With Actual Witches,8/28/2015
Apple Vacations Promo Code & Coupons,8/29/2015
New iPhone? Apple Announces Event on September 9,8/29/2015
Apple TV,8/29/2015
"Apple Will Launch iPhone 6S on Sept 9, iPhone 5C to be Discontinue.",8/29/2015
Apple Stops Tidal From Streaming Drake’s Set at Lil Weezyana Fest,8/29/2015
"Did Tim Cook Lie To Save Apple Stock: Apple ""Channel Checks"" Paint A Very Gloomy Picture",8/29/2015
Tidal Accuses Apple of Preventing Them from Streaming a Drake's Live performance,8/29/2015
Apple Support Phone Number,8/29/2015
Why Apple Showing Increased Interest in Sapphire Lens Manufacturing ?,8/31/2015
Green Apple School Baddi | Kids School Baddi,8/31/2015
Green Apple School Baddi | eLearning School Baddi (HP),8/31/2015
Here are all the features for New Apple TV 4,8/31/2015
Apple will let iPhone and iPad users block ads,8/31/2015
iPhone app for Android watches to make them compatible with Apple,8/31/2015
"Apple Exploring Original Programming Move, Could Compete with Netflix",8/31/2015
"Apple Spire in 2BHK & 3BHK Apartments for sale on MysoreRoad, Bangalore.",9/1/2015
Apple invited Jeremy Clarkson of Top Gear in his own show,9/1/2015
"Imagine if it actually was bad news for apple, the world’s largest company",9/1/2015
"Imagine if it actually was bad news for apple, the world’s largest co…",9/1/2015
"Hackers have stolen more than 225,000 Apple accounts from iPhone customers. The good news for most iPhone customers is that the malware, nicknamed KeyRaider, only targets ""jailbroken"" iPhones.",9/1/2015
"MENANGI APPLE MACBOOK PRO, IPHONE 6, ATAU GOPRO DENGAN MENJAWAB TINJAUAN INI.",9/2/2015
Take away Apple ID iOS 9 iCloud Activation Bypass By Download Doulci Activator. | Jailbreak Updates,9/2/2015
University of Oklahoma becomes the first university to accept Apple Pay across its campus.,9/2/2015
Xiaomi will release a “killer» Apple MacBook in the beginning of 2016,9/2/2015
"New Apple TV Will Feature Universal Search, Start At $149",9/2/2015
Apple® Support Number,9/2/2015
Apple ID Login - Reset Security Questions,9/3/2015
Online Discount for Apple iPhone 5S with 24% OFF,9/3/2015
Buy Delicious Caramel Apple Popcorn Online,9/3/2015
Airbnb Built An Apple Watch App,9/3/2015
apple iphone 7 features,9/4/2015
"Google, Apple settle high-tech workers' lawsuit",9/4/2015
"With a Revamped Apple TV, Company Hopes to Camp in Your Home",9/4/2015
Call at 1-800-251-4919 to Apple Safari Support Technical Support Phone Number,9/4/2015
This Fan-Made Apple Concept Art Is Too Awesome to Be Real,9/4/2015
"Apple, Google, others settle antipoaching lawsuit for $415 million",9/4/2015
"Nhà thiết kế Milos Paripovic vừa tung ra mẫu toilet iPoo mang phong cách Apple. Chiếc bồn cầu này được quảng cáo ""tuyệt vời"" đến nỗi người dùng có thể dành cả ngày để... ngồi trên đó.",9/4/2015
Why Android Wear will give the Apple Watch a run for its money,9/5/2015
"Lottery Scam: ""Your Gmail Address has Just Won You 500000 USD and Apple Laptop""",9/5/2015
"New Apple TV Is Said to Focus on Games, Challenging Traditional Consoles",9/6/2015
Apple to build Fuel Cell Battery that Could Power iPhones and Macbooks for Weeks,9/7/2015
"American as Apple Pie: Ben Kuroki, WW2 Japanese-American, dies at 92 (A Hero)",9/7/2015
Apple to launch Apple TV with focus on gaming,9/7/2015
Here's What We Know About the New Apple TV,9/7/2015
Apple might be working on a super-thin iPhone 7,9/7/2015
Apple and Other Tech Companies Tangle With U.S. Over Access to Data,9/7/2015
"Apple is hiring artificial intelligence experts to make the iPhone better, but there's a catch. Apple analyses its users’ behaviour under self-imposed constraints to better protect their data from outsiders.",9/7/2015
Apple and Other Tech Companies Tangle With U.S. Over Data Access,9/7/2015
Keratosis Pilaris Apple Cider Vinegar Home Remedy,9/8/2015
iPhone 6S is coming! While Apple makes it more affordable than ever ->,9/8/2015
Địa chỉ thay màn hình HTC one x tại Hà Nội | ApplerVn - Cộng Đồng Apple & Android Việt Nam,9/8/2015
Online shopping for Tempered Glass for Apple iPhone 6 Plus,9/8/2015
Support for Apple Devices,9/8/2015
"Daily Report: It's All Apple, All Week",9/8/2015
American company claimed Apple iPhone 6S change the name to the iPhone 7,9/8/2015
21 Of The Best Things That Ever Happened In An Apple Store,9/8/2015
Apple can't give real time iMessage data to the FBI because texts are encrypted,9/8/2015
Apple brings ad-blocker extensions to Safari on iPhones,9/8/2015
Sept 9th Apple Event Live Blog,9/8/2015
"Apple bought into ""Beats by Dre"" SCAM but is still making millions.",9/8/2015
"the Justice Department obtained a court order this summer demanding that Apple turn over, in real time, text messages between suspects using iPhones. Apple’s response: Its iMessage system was encrypted and the company could not comply.",9/8/2015
F.B.I. considered taking Apple to court over encryption fears,9/8/2015
Apple iPhone 6S and 6S Plus: The Force is strong for Tim Cook's next press event #TaiwaneseAnimators,9/8/2015
All About apple iphone & iPad,9/8/2015
Primary Schools in Baddi | Green Apple Public School,9/9/2015
Everything You Need To Know About Today's Big Apple Event,9/9/2015
Person already camped in front of Apple store in Sydney,9/9/2015
Video: Haptic’s Future Beyond the Apple Watch,9/9/2015
First Orkut Next May Apple,9/9/2015
Apple Unveils The iPad Pro,9/9/2015
Apple announces cell phone breakthrough. iPhone 6 now available in Rose Gold.,9/9/2015
Apple Watch’s Airstrip Can Differentiate Between Baby And Mother’s Heart Rate,9/9/2015
Get a new iPhone every year now with new Apple iPhone Upgrade Program,9/9/2015
New Apple Iphone 6s,9/9/2015
Apple Unveils Its Latest iPhones,9/9/2015
Ipad Pro &Apple Pencil,9/9/2015
Apple Just Made It Way Easier to Switch From Android,9/9/2015
World Top Company Apple Announce New TV With Siri Time to Shine,9/9/2015
The new iPad Pro and Apple Pencil Announced,9/9/2015
Newly launched Apple iPhone 6s price and specs,9/9/2015
"#AppleEvent 2015: Live Updates, Unveiling of iPhone 6s, iPad Pro, Apple Pencil",9/9/2015
ملخص كل ما عرض في مؤتمر أبل 2015 “آبل تي في” Apple TV,9/9/2015
"New iPad Pro, new Apple TV and iPhone 6S handsets revealed",9/9/2015
Apple and Adobe ‘fix’ female smile at iPad Pro unveiling,9/9/2015
See Everything Apple Just Announced in 2 Minutes,9/9/2015
17 Things Apple Just Announced That Are Basically Other Things,9/9/2015
"To Tim Cook of Apple: iPad Pro Is a Dumb Name, You Aren't the Promoter of Ideas That Jobs Was and Jobs Was Right: Nobody Wants a Stylus",9/9/2015
Tech Time: Everything You Need to Know About Today's Apple Event,9/9/2015
‘White tech dude says woman should smile’: Apple accused of sexism in Keynote presentation,9/9/2015
Everything Apple Announced That Someone Else Already Did,9/9/2015
Apple Live Event Sept 2015 Recap,9/9/2015
A fan of Apple products has taken place for the iPhone 6s before his announcement,9/9/2015
"Apple iPhone 6s, 6s Plus launched : Will land on 25 September",9/10/2015
Apple iPhone unveil lacks sizzle of past events,9/10/2015
Apple Pencil: Hands-On With Apple’s Stylus For The iPad Pro,9/10/2015
Apple is fundamentally changing how you use your iPhone,9/10/2015
What Does Apple Event Has In Store for the Apple Fans,9/10/2015
Apple Inc. (NASDAQ:AAPL) Declared Latest News Updates,9/10/2015
"Apple (AAPL) Introduces iPhone 6s, Giant iPad Pro, Apple Pencil at 2015 Special Event",9/10/2015
"Apple conference starts with developments in iWatch, OS",9/10/2015
Steve Jobs Totally Dissed the Stylus 8 Years Before Apple Pencil,9/10/2015
The Apple iPad Mini 4 vs iPad Mini 3: What's changed?,9/10/2015
Apple Peel (And Green Tomato) Prevents Muscle Wasting In Elderly,9/10/2015
Thorough Quick guide On How you can Utilize Your Apple iphone,9/10/2015
China says Apple unit underpaid $71 million in tax in 2013 (x /r/newsy),9/10/2015
Apple Exec Explains Why the New iPhone Has to 'Read Minds',9/10/2015
Wall St. bounces back with Apple; biotechs a boost,9/10/2015
Apple criticized for Photoshopping smile on woman's face,9/10/2015
"Replacement Parts for Apple iPhone 6 Loud Speakers, iphone speakers, speakers for iphone 6",9/10/2015
"Apple, in refusing backdoor access to data, may face fines",9/11/2015
"Tin tức - Sau khi iPhone 6s ra mắt, giá cổ phiếu của Apple bị giảm mạnh | Cộng đồng LG Việt",9/11/2015
Farhad and Mike’s Week in Tech: Android Pay and Apple Products,9/12/2015
"APPLE and the secret recipe for ""money sauce""",9/12/2015
Apple New iMac will be launched in October with 21.5-Inch 4K Display,9/12/2015
Tim Cook’s coming of age: How the Apple Inc CEO stepped out of Steve Jobs’ shadow,9/12/2015
#ApPle# Pittsburgh vs Akron Live Stream NCAA Football Game 2015,9/12/2015
TV Bundles Challenge Apple to Make a Deal,9/13/2015
Apple Tech Support Phone Number,9/14/2015
Apple TV 2015 Concept Looks Better Than the Real Deal,9/14/2015
Apple: iPhone 6S Pre-Sales On Pace To Beat Last Year's Record,9/14/2015
Apple Says iPhone Pre-Orders Are Beating Last Year's Pace,9/14/2015
"1 dead, 1 critical in Apple Valley stabbing: Police say a man is dead from a self-inflicted stab wound, while a woman clings to life in a local hospital. (MN)",9/14/2015
Spotify CEO: Company Has Seen Faster Growth Since Apple Music Debut,9/14/2015
Burberry Creates a Channel for Apple Music,9/14/2015
apple -ios- lo malo- 4 cosas,9/14/2015
"While Apple Unveils Their New Line Of merchandise, The Internet Is Right There To Mock It!",9/15/2015
Police Officer Charged with Stalking Apple Valley Woman,9/15/2015
Apple Might Let You Delete Those Apps You Never Use,9/15/2015
Apple CEO Tim Cook on ‘The Late Show With Stephen Colbert’,9/16/2015
Apple will finally let you delete the iPhone's default apps,9/16/2015
APPLE IOS 9 RELEASES TODAY HAS MANY NEW FEATURES TECH REPORT,9/16/2015
Why Apple (and Google) Want Your Genetic Information,9/16/2015
Apple Delays Release Of Watch OS 2,9/16/2015
How-to: Subscribe in Apple News,9/16/2015
Apple is finally getting rid of newsstand,9/16/2015
Two men try to sell kidney for latest Apple iPhone 6s,9/17/2015
Apple Charger Price Online,9/17/2015
Crazy Chinese Duo Try To Sell Their Kidneys To Buy Apple iPhone 6s,9/17/2015
Apple computer repair services in Thousand Oaks,9/18/2015
Apple Fusion Keyboard Could Make Touchpads Outdated,9/18/2015
Apple meets California officials to discuss self-driving car,9/18/2015
Apple customers report devices crashing on iOS 9 update,9/18/2015
Apple is pushing consumers to lease iPhones instead of making a flat purchase,9/18/2015
Self-driving Apple car may be 'almost ready for public view' following talks with California DMV - report,9/18/2015
"Tim Cook Says Apple Is Making A ""Substantial Donation"" To Refugee Groups",9/18/2015
Tim Cook: Apple is killing it in China,9/18/2015
The new Apple iOS 9 has issues,9/19/2015
"Catch or Miss ? 1byone #Apple iPad Air/Air 2 Glass screen Protector $15.99, now $ 11.99 with #coupon (Amazon): 2ZNYKEKS. End Date: 10/31/2015 11:59 PM. #Free shipping with Prime or $35 order. Saving equals to Earning!",9/19/2015
Apple Targeted as Hackers Infect Popular Chinese Mobile Apps With Malware - WSJ,9/20/2015
Apple to appeal its e-book antitrust defeat,9/20/2015
Apple Confirms Discovery Of Malicious Code In Some App Store Products,9/20/2015
Apple removes malicious programs after first major attack on app store,9/21/2015
Apple App Store Hit by Major Malware Attack-Many Infected Apps Removed,9/21/2015
Millions of iPhone users at risk as Apple is hit by first major hack,9/21/2015
"Apple Improves the Watch, Slightly",9/21/2015
"His Heart, Liver and Kidneys Had Started to Shutdown. Here’s How a Teen Says His Apple Watch Helped Save His Life.",9/21/2015
"Apple speeds up electric-car effort, sees 2019 shipments: DJ, citing sources",9/21/2015
"We Shouldn’t Forget That Several 9/11 Terrorists Were Named ‘Ahmed’ And ‘Mohamed’ - Bristol apple, not far from Sarah tree",9/21/2015
It's Time To Update Your Apple Watch,9/21/2015
"Видео Новости. Разное. Доступ властей к данным граждан, Apple передает и...",9/21/2015
"Apple to pay Cleveland Indians bullpen ransom for Brandon Moss home run ball-Own team holds ball ransom, 50 gallon drum of lube requested",9/21/2015
Apple Yanks Infected Apps After Malware Hits App Store,9/21/2015
"Apple announces it will move forward with producing an electric car, sets 2019 release date.",9/21/2015
Apple with record $18bn quarterly profit,9/21/2015
Ready for an Apple car? Report says company moving forward with project,9/21/2015
Hundreds of Apple apps are infected by malware in China,9/21/2015
Over 40 Apple apps infected with malware,9/21/2015
Apple sets a target date 2019 to start shipping electric cars,9/21/2015
Apple Ready For Car Regulation,9/22/2015
Buy Apple Laptop Battery,9/22/2015
Double Bed Sheet Apple Green In Multicolor Square,9/22/2015
Apple Developing a Car | SPEEDspectator.com,9/22/2015
"Apple, Microsoft, Adobe, Symantec, and a handful of other tech companies just began publicly lobbying Congress to pass the Cybersecurity Information Sharing Act (CISA), a bill that would give corporations total legal immunity when they share private user data with the government and with each other",9/22/2015
"Apple car to ship by 2019, report says | CBCNews.ca Mobile",9/22/2015
"Apple car to ship by 2019, report says",9/22/2015
Apple iPhone 6S and 6S Plus Prices-Features-Specification,9/22/2015
Apple announces electric car for 2019,9/22/2015
The Apple App store hack: China’s Internet controls played a part,9/22/2015
Apple iPhone 6s review and specification,9/23/2015
Apple Iphone 6s- Apple Iphone 6s Price in India,9/23/2015
Apple A10 Processor Details Emerge-acelebritynews,9/23/2015
Apple car might be a disaster,9/23/2015
Skype Worldwide Outage Follows Apple Malware Attack,9/23/2015
"In A Crowded Smartwatch Field, Pebble Takes On Apple And Google",9/23/2015
Apple car announced for 2019 | TheCelebrityCafe.com,9/23/2015
"NYC: Off-duty cops who plan to see the pope during his tour of the Big Apple ​are being warned to leave their guns at home — or face being ​sent away and ​reprimanded by NYPD brass, police officials warned in a memo.",9/23/2015
Apple aims to 'ship' electric car in 2019,9/23/2015
China's 'fake' Apple stores thrive ahead of new iPhone launch,9/24/2015
"Apple, Microsoft, others slammed for supporting cybersecurity bill",9/24/2015
Apple Releases iOS 9.0.1 for iPhone 6s and 6s Plus,9/24/2015
"Apple redesigns iTunes Connect, updates Apple Store app for iPhone 6s",9/25/2015
Apple has now approved the ADF Plan App,9/25/2015
"iPhone 6S is More Powerful Than the New Apple MacBook, Test Shows",9/25/2015
Apple tells the 25 Most Popular XcodeGhost Infected iOS Apps,9/25/2015
Apple lists top 25 apps hit by malware in first major attack,9/25/2015
iPhone Surrogate: telepresence robot waits in line for new Apple phone,9/25/2015
Samsung Galaxy S6 Edge Plus Review-The Only Competitor To Apple iPhone 6S,9/26/2015
Apple can break iPhone Sales Record Again: are You Buying?,9/26/2015
Fix Line Issue beneath Apple Logo,9/28/2015
Dash Radio: What happens when Apple swipes your mic? (Q&A),9/28/2015
Apple iPhone 6s Breaks First-Weekend Sales Record,9/28/2015
NEWS: Apple Announces Record iPhone Sales,9/28/2015
Apple Has Sold More Than 14 Million New iPhones Since Friday,9/28/2015
Apple Sells record 13 Million new iPhones,9/28/2015
Today News Update: Apple Inc. (NASDAQ:AAPL),9/28/2015
"Samsung’s new Silicon Valley headquarters Let's go inside. Although Apple already flying saucer design, Samsung's new Silicon Valley office looks more like a giant Rubik's Cube. The $ 30 billion US dollars in school building opened yesterday,",9/29/2015
"Apple iPhone 6S, 6S Plus launching in India on Oct 16",9/29/2015
Apple sells 13 million iPhones over weekend,9/29/2015
Apple iPhone 6s Price-Specification and Full Features,9/29/2015
Apple at it again,9/29/2015
An app which tracked US drone strikes through text notifications and maps has been removed from the App Store by Apple due to “excessively crude or objectionable content”,9/29/2015
Apple Safari Tech Support Services,9/30/2015
Apple ordered to pay $4.2 million for botched iPad program in LA,9/30/2015
"Anggap Sebagai Pasar Potensial, Apple Berikan Harga Khusus untuk Pelanggan di Tiongkok | Media Musik Digital - Teknologi",9/30/2015
TAI NGHE BLUETOOTH CHUẨN APPLE CHO IPHONE,9/30/2015
Stop Spinning Wheel in Apple Device,9/30/2015
Free Apple Music Trial Ends Today,9/30/2015
Russian Police Investigate Apple Over Gay Emojis,9/30/2015
NEWS: Apple Releases iOS 9.0.2 and Safari 9.0,9/30/2015
Tim Cook: Users Need to See Microsoft and Apple Working Together,9/30/2015
Here's How Apple Could Change the Web Forever,9/30/2015
Apple rakes in $513 on every iPhone 6s Plus sale,9/30/2015
Apple iPhone Users Seen Shifting to Higher Memory Versions,10/1/2015
Apple removes iPhone app that reports US drone strikes - CNET,10/1/2015
Google Maps- Now available on Apple Watch in latest iOS app update,10/1/2015
"Amazon Will Ban Sale of Apple, Google Video-Streaming Devices",10/1/2015
NEWS: New DODOCase Products for New Apple Products,10/1/2015
Amazon Is Kicking Out Chromecast and Apple TV,10/1/2015
Amazon to drop sales of Google's Chromecast and Apple TV to boost Prime Video.,10/1/2015
Amazon to stop sales of Google's Chromecast and Apple TV to boost Prime Video.,10/1/2015
Amazon To Stop Selling Apple TV And Google Chromecast,10/1/2015
Apple CEO Tim Cook: 'Privacy Is A Fundamental Human Right',10/1/2015
Mua tai nghe bluetooth chuẩn Apple cho Iphone,10/1/2015
Apple 'trying to fix' problem of iPhone roaming charges,10/2/2015
Amazon to Stop Selling Apple TV and Chromecast,10/2/2015
FLAT 99 Rupee for Mini Adapter for Apple to Micro USB,10/2/2015
"Amazon Bans Sale Of Competing Apple TV, Chromecast Devices To ‘Avoid Customer Confusion’",10/2/2015
The apple company will buy new venture to help you Siri behave similar A real person,10/2/2015
Apple removed drone-strike apps from App Store due to 'objectionable content',10/3/2015
What's behind Amazon’s baffling decision to ban Apple TV and Chromecast?,10/4/2015
Why Apple CEO Tim Cook has good reason to turn down Modi's invite to visit India,10/4/2015
Apple iPhone 6s is 4th Times More Popular Than the 6s Plus,10/5/2015
NEWS: Best Buy Now Offers Apple Pay,10/5/2015
Apple became the world’s No. 1 brand,10/5/2015
How to Find and Install Apps on Your Apple Watch,10/5/2015
"Four years ago today Steve Jobs, founder and cult leader of Apple died. Is Apple better or worse without Steve Jobs? Image credit: photocritical / Shutterstock.com inShare 6 BUSINESS MANAGEMENT Is Apple better or worse without Steve Jobs?",10/5/2015
Apple Valley Garage Door Repair,10/6/2015
So plastic bags are now 5p in England.....Apple caught on.,10/6/2015
apple watch fitness,10/6/2015
apple watch fitness app reviews,10/6/2015
Attractive Stylish Apple Watches in UAE at Best Prices,10/6/2015
Apple and Google lead Interbrand list as the world’s top two most valuable brands,10/6/2015
Apple OS X anti-malware tool easily bypassed,10/6/2015
Apple Roses Free news,10/7/2015
Apple is still No. 1 at avoiding US taxes,10/7/2015
"With the Surface Book, Microsoft is taking the game to Apple",10/7/2015
APPLE USES STEVE JOBS'S ASHES IN NEW PRODUCTS,10/7/2015
"Apple Is #1 Tax Evader, Dodged $60 Billion In Taxes: Study",10/7/2015
Apple pulls iFixit's iOS app and developer account following Apple TV teardown,10/8/2015
Publish Academy Review - Apple iPad Air 2 Bonus For Everyone! Publish Ac...,10/8/2015
Laptop Comparisons: Apple MacBook Pro vs Chromebook Pixel vs Microsoft Surface ...,10/8/2015
Facebook Messenger For Apple Watch Officially Launches,10/9/2015
Elon Musk Gets Caught Lying About Apple,10/9/2015
Elon Musk says Apple is the 'graveyard' for ex-Tesla staff,10/9/2015
Apple and the Transistor-gate,10/9/2015
Apple: iOS 9 almost impossible to jailbreak because of Rootless?,10/9/2015
Starbucks Will Start Accepting Apple Pay,10/9/2015
"Elon Musk calls Apple a Tesla graveyard: ""Important engineers? They have hired people we've fired.""",10/9/2015
Elon Musk says Apple is the 'graveyard' for fired Tesla staff,10/9/2015
Apple Removes ‘A Few’ Apps Including Ad Blockers From App Store For Installing Root Certificates,10/9/2015
Apple hijacking every itunes store link posted by every artist selling content on itunes and redirecting those links to apple music sign up page. Countless dollars lost by artists.,10/9/2015
Apple: Data shows TSMC and Samsung iPhone 6S models have similar battery life,10/9/2015
Apple: iPhone 6S battery life won't suffer due to different A9 chips,10/10/2015
